contentid,contenttypeid,title,createdtime,modifiedtime,tel,telname,homepage,booktour,firstimage,firstimage2,cpyrhtDivCd,areacode,sigungucode,cat1,cat2,cat3,addr1,addr2,zipcode,mapx,mapy,mlevel,overview
2603489,12,인천대공원 반려동물 놀이터,20190528014907,20250326182526,,,"<a href=""https://www.incheon.go.kr/park/park010218""_blank"" title=""새창 : 홈페이지로 이동"">https://www.incheon.go.kr/index</a>",0,http://tong.visitkorea.or.kr/cms/resource/83/2603483_image2_1.bmp,http://tong.visitkorea.or.kr/cms/resource/83/2603483_image2_1.bmp,Type3,2,4,A02,A0202,A02020700,인천광역시 남동구 무네미로 236,인천대공원 내(제 1주차장 축구장 뒤편),21533,126.7493033010,37.4577461335,6,"반려견과 반려인이 마음껏 뛰어놀 수 있는 반려동물 놀이터가 2018년 인천대공원에 문을 열었다. 이곳은 인천에 처음으로 조성된 반려동물 놀이터로 대형견과 중·소형견 놀이터가 분리되어 있으며, 흥미로운 공간으로 꾸며졌다. 또한 대형파라솔 및 야외탁자 등을 설치해, 반려동물을 동반한 이용자들도 휴식과 놀이를 함께 즐길 수 있도록 했다. 심지어 별도의 입장료가 없이 무료로 이용할 수 있기 때문에 시민들이 더욱 많이 이용한다. 또한 다양한 조형물이 설치되어 있어 멋진 사진을 남길 수 있다."
3015077,12,인천대공원 어린이동물원,20230829134954,20241119135304,,,"<a href=""http://www.incheon.go.kr/park/park010214"" target=""_blank"" title=""새창 : 홈페이지로 이동"">http://www.incheon.go.kr</a>",,http://tong.visitkorea.or.kr/cms/resource/56/3015056_image2_1.jpg,http://tong.visitkorea.or.kr/cms/resource/56/3015056_image3_1.jpg,Type3,2,4,A02,A0202,A02020600,인천광역시 남동구 무네미로 236 인천대공원사업소,,21533,126.7493033010,37.4577461335,6,"인천대공원의 남문에 위치하고 있는 어린이동물원에는 37종 236마리의 동물이 살고 있다. 맹수류는 없고 토끼, 기니피그, 일본원숭이, 마모셋, 사막여우, 왈라루, 미어캣, 청금강앵무, 타조 등 주로 위험하지한 동물들 않고 순이 많다. 독수리나 수리부엉이처럼 천연기념물로 지정된 동물들도 있다. 각 동물들 앞에는 동물들의 특징이나 생김새를 어린이들이 이해하기 쉽게  적어놓은 안내문구들이 있어 동물을 이해하는데 도움을 주고있다. 
동물원내에서는 정해진 시간에 일반인들을 대상으로 동물원 곳곳을 돌아다니며 설명해주는 해설 프로그램이 있으며, 안전과 동물들의 스트레스를 줄이기 위해 먹이주기 체험은 하지 않는다."
3422770,12,인천대공원 치유숲길,20241120174108,20241227104214,0324667282,,https://www.incheon.go.kr/park/index,,http://tong.visitkorea.or.kr/cms/resource/92/3422792_image2_1.JPG,http://tong.visitkorea.or.kr/cms/resource/92/3422792_image3_1.JPG,Type1,2,4,A01,A0101,A01010600,인천광역시 남동구 무네미로 236 (장수동),,21533,126.7493033010,37.4577461335,6,"인천대공원 치유숲길은 인천광역시 남동구에 위치한 인천대공원 내에 조성된 치유와 힐링을 위한 특별한 숲길이다. 이 길은 자연 속에서 심신의 안정을 찾을 수 있는 공간으로, 자연의 소리와 향기를 통해 스트레스 해소와 정신적 회복을 돕는다. 숲길은 평탄한 산책로와 휴식 공간이 잘 마련되어 있어, 걷기, 명상, 요가 등 다양한 힐링 활동을 즐길 수 있다.
치유숲길은 어린이부터 노약자까지 누구나 이용할 수 있으며, 숲의 향기와 맑은 공기를 만끽하며 자연과 하나 되는 경험을 제공한다. 또한, 공원 내의 다양한 식물과 나무들을 관찰할 수 있어 자연 교육의 기회를 제공하며, 이곳을 방문하는 사람들이 자연에 대해 더 많은 관심을 가질 수 있도록 돕는다.
인천대공원 치유숲길은 특히 도시의 번잡함에서 벗어나 여유로운 시간을 보내고 싶은 사람들에게 추천할 만한 장소이다. 여유롭게 걸으며 스트레스를 해소하고, 자연과의 교감을 통해 몸과 마음을 치유할 수 있다. 또한, 공원 내에는 다양한 편의시설이 갖춰져 있어 가족 단위 방문객들도 편안하게 이용할 수 있다."
821412,12,인천대교,20091016024718,20250318153530,,,"<a href=""http://www.incheonbridge.com/"" target=""_blank"" title=""새창 : 인천대교(주) 홈페이지로 이동"">http://www.incheonbridge.com</a>",0,http://tong.visitkorea.or.kr/cms/resource/62/3393362_image2_1.JPG,http://tong.visitkorea.or.kr/cms/resource/62/3393362_image3_1.JPG,Type3,2,10,A02,A0205,A02050100,인천광역시 중구 인천대교고속도로 3,,22378,126.5476448037,37.4256657486,6,"인천대교는 총연장 21.38㎞, 왕복 6차선 도로로 우리나라에서 가장 길고 세계적으로도 다섯 번째로 긴 사장교이다. 바다로부터 솟은 인천대교 주탑은 238.5m로, 63빌딩 높이와 맞먹는 높이다. 다리를 받치고 있는 교각은 10만톤의 충격과 규모 7.0의 지진, 초속 72m의 강풍에도 견딜 수 있을 정도로 튼튼하다.
영국 건설 전문지 컨스트럭션 뉴스는 ‘세계 10대 경이로운 건설 프로젝트’로 인천대교 건설을 꼽았다. 국내외 토목전문가들은 세계의 3대 아름다운 다리로 주저 없이 인천대교를 꼽는다. 야경이 특히 매혹적이며 인근에 인천대교 프로젝트의 시작부터 완공까지의 건설 과정, 국내 교량 건설의 기술력 등 자세히 전시한 인천대교기념관이 있다."
2768138,12,인천대교전망대,20211104194540,20250318161601,,,"<a href=""https://itour.incheon.go.kr/ssst/ssst/detail.do?pgListMode=S&cotId=ITD21122816410136332"" target=""_blank"" title=""새창 : 인천 문화관광 홈페이지로 이동"">https://itour.incheon.go.kr</a>",0,,,,2,8,A02,A0205,A02050600,인천광역시 연수구 송도동 30-9,,,126.6290465320,37.3960372885,6,"인천광역시 연수구 송도동에 있는 전망대로 송도 랜드마크시티2 공원과 고층 아파트, 그리고 멀리 바다 위로 모습을 살짝 드러낸 인천대교의 조화로운 풍경을 볼 수 있는 전망대이다. 인천대교 전망대의 독특한 점은 컨테이너로 지어졌다는 점이다. 컨테이너는 물류 도시인 인천을 상징하는데, 단순한 건물이 아니라 장길환 작가의 작품이다. 이 작품은 2010년 독일 레드닷 디자인 어워드에서 ‘건축 조형물 분야’에서 대상을 수상하기도 했다. 인천대교전망대는 서해와 일몰, 인천대교를 조망하는 전망대이자 전시공간을 제공할 목적으로 기획됐다. 전망대를 나오면 나무 데크로 만들어진 넓은 바닥과 벤치가 있어 쉬어가기 좋다. 뒤로는 송도의 고층 빌딩과 앞으로 펼쳐진 서해가 해안 도시의 멋스러움을 더해준다. 전망대 앞으로는 워터프론트 호수가 있고 인근에는 인천 아트센터와 센트럴파크, G타워가 있다.

(출처 : 인천투어)"
129341,12,인천도호부관아,20061108090000,20240610135226,,,"▪ <a href=""http://www.dohobu.org/"" target=""_blank"" title=""도호부청사 사이트로 이동"">http://www.dohobu.org</a><br>▪ <a href=""https://blog.naver.com/tong_namgu/223375010514""target=""_blank"" title=""새창 : 인천 공식 블로그로 이동"">https://blog.naver.com/tong_namgu</a>",0,http://tong.visitkorea.or.kr/cms/resource/85/3079385_image2_1.jpg,http://tong.visitkorea.or.kr/cms/resource/85/3079385_image3_1.jpg,Type3,2,3,A02,A0201,A02010100,인천광역시 미추홀구 매소홀로 553,(문학동),22233,126.6823626896,37.4394720720,6,"미추홀구 문학동 승학산 자락에 위치한 인천도호부관아는 조선시대 행정을 담당했던 관청 건물이다. 인천도호부관아의 건축 시기는 정확히 알려져 있지 않지만, 객사를 보수하는 과정에서 발견된 지붕의 기와에서 강희 16년이라는 명문이 나온 것을 볼 때 숙종 3년(1677)에 중수된 것임을 알 수 있다. 
‘인천부읍지’(1899)에 의하면 인천도호부관아 건물은 객사를 비롯해 부사의 집무처인 동헌, 내동헌 등 15~16동으로 구성돼 있다. 그러나 이 건물들은 근현대 이후 여러 용도로 사용되다가 문학초등학교를 세우면서 지금의 위치로 이전해서 개축하였기 때문에 당초 건물의 배치나 형태를 알 수 없게 되었다. 
현재는 인천향교 옆 부지를 활용해 임금의 위패가 모셔져 있고 숙소로 사용된 객사, 정문인 아문, 부사의 집무실인 동헌, 6방의 집무치인 중문, 부엌과 곳간으로 쓰이는 공수, 객사를 출입하기 위한 삼문, 동헌으로 드나들 때 사용하는 사주문이 세워져 있다. 또한, 투호놀이, 맷돌돌리기, 활쏘기, 제기차기, 윷놀이와 예약으로 체험할 수 있는 고리장식만들기, 전통차체험, 호패만들기, 전통의복체험, 내가바로인천도호부사 프로그램이 있다."
2781589,12,인천로봇랜드,20211126193921,20250320160348,,,"<a href=""http://www.robotland.or.kr/"" target=""_blank"" title=""새창 : 인천로봇랜드 사이트로 이동"">http://www.robotland.or.kr/</a>",0,http://tong.visitkorea.or.kr/cms/resource/53/2781653_image2_1.jpg,http://tong.visitkorea.or.kr/cms/resource/53/2781653_image2_1.jpg,Type3,2,7,A02,A0202,A02020600,인천광역시 서구 로봇랜드로 155-11,(청라동),22851,126.6109530869,37.5196975976,6,"인천로봇랜드는 인천광역시가 로봇랜드 조성지역으로 지정되며 만들어진 공간으로 산업용지, 테마파크, 업무용지, 상업용지 등이 함께 입지 하는 로봇 복합 타운으로 조성되어 있다. 로봇타워 1층 체험관에서는 50분의 시간 동안 다양한 로봇을 만나볼 수 있다. 물이 든 수조 속에서 위치를 감지하여 헤엄치는 물고기 로봇, 체험자와 오목을 겨루는 오목 로봇 등 체험 및 관람을 할 수 있다. 가족과 함께 재미있는 시간을 보낼 수 있는 곳이다."
2768195,12,인천북항다목적부두,20211104202119,20240823133731,,,,0,http://tong.visitkorea.or.kr/cms/resource/96/2790596_image2_1.jpg,http://tong.visitkorea.or.kr/cms/resource/96/2790596_image2_1.jpg,Type3,2,7,A01,A0101,A01011400,인천광역시 서구 북항로 135,(원창동),22855,126.6319710049,37.5055773883,6,"인천 서구와 동구의 공업단지를 배후에 두고 있는 인천 북항은 다목적 부두, 제 4부두, INTC 부두 3부두가 있다. 인천 북항은 원목, 고철, 사료용 부원료 등 산업 원부자재 화물을 취급하는 종합항만으로 5만 톤급 12개를 포함해 총 26개 선석을 보유하고 있다. 업체들은 주로 석유화학, 목재, 합판, 건축 및 인테리어 자재 등을 다루는 목재 전문기업으로, 산업 원부자재 화물을 취급하는 인천 북항에 특화되어 있다. 항만하역과 물류창고 시설을 갖췄고 통관업무와 화물 운송 중개 등 수상 화물 처리의 대표 부두이다.
인천북항다목적부두는 안전문화를 확산시키고 야간 안전사고 예방을 위한 로고라이트 4기를 설치하여 운영해오고 있다. 로고라이트는 조명을 이용해 문구나 이미지를 바닥 또는 벽면에 비추는 장치로, 조도를 높임과 동시에 메시지를 항만작업자와 차량 운전자가 쉽게 확인하도록 부두 진입로 및 창고 벽면 등을 향해 설치함으로써 야간에 일어날 수 있는 안전사고를 예방할 수 있다. 안전 보호구 필수 착용과 항 내 차량 운행속도 준수, 작업·운전·보행 중 휴대전화 사용 금지, 항 내 이동 시 지정 보행로 이용 등의 안전 수칙을 담았다.
인천북항다목적부두는 인천의 대표적 부두로의 역할을 다할 뿐 아니라 항만 안전 문화 확산사업과 항만이용자의 안전 확보를 위한 시설 확충에도 힘쓰고 있다."
2768127,12,인천신항관리부두,20211104193714,20250121141439,,,,0,,,,2,8,A01,A0101,A01011400,인천광역시 연수구 인천신항대로 707,(송도동),22031,126.6364083414,37.3464570625,6,인천 신항은 무인 자동화 크레인 등 최신 항만 인프라를 갖추고 있는 해운 물류 중심기지이다. 인천 신항 관리 부두에는 엄청난 규모의 화물주차장이 펼쳐져 있다. 관리 부두 주변으로 나 있는 인도에는 자전거도로가 같이 있어 항만의 분위기를 느끼며 운동할 수 있다. 신항 부두 주변에 항만시설인 방파제 호안이 있으며 바다 위 다리 도로에서는 바다 낚시를 즐기는 사람들에게 인기가 많은 장소이다.
3457765,12,인천애뜰,20241223144621,20241227113352,,,,,http://tong.visitkorea.or.kr/cms/resource/42/3457642_image2_1.JPG,http://tong.visitkorea.or.kr/cms/resource/42/3457642_image3_1.JPG,Type1,2,4,A02,A0203,A02030400,인천광역시 남동구 정각로 29 (구월동),,21554,126.7060989801,37.4550873442,6,"인천애뜰은 인천광역시 남동구 구월동에 위치한 시민 광장이다. 
 2019년 11월에 개장하여, 인천시청사와 옛 미래광장 사이의 도로를 없애고 조성된 약 2만㎡ 규모의 열린 공간이다. 
 이곳은 '인천에 있는 사랑이 넘치는 공간'이라는 의미를 담고 있다. 
광장 내에는 잔디광장, 바닥분수, 미디어 파사드, 포토존, LED 구조물 등이 설치되어 있어 시민들의 휴식과 문화 활동 공간으로 활용되고 있다. 
 또한, 다양한 문화 행사와 전시가 개최되어 시민들에게 풍부한 문화 경험을 제공한다."
2781599,12,인천어린이천문대,20211126195151,20250320161602,,,"<a href=""http://astrocamp.net/"" target=""_blank"" title=""새창 : 인천어린이천문대 사이트로 이동"">astrocamp.net</a>",0,http://tong.visitkorea.or.kr/cms/resource/16/3395816_image2_1.JPG,http://tong.visitkorea.or.kr/cms/resource/16/3395816_image3_1.JPG,Type3,2,7,A01,A0101,A01010500,인천광역시 서구 원당대로 454-14,,22671,126.6526667493,37.5904345493,6,"인천어린이천문대는 인천광역시 서구 왕길에 위치한 어린이와 청소년을 위한 교육적 공간이다. 이 천문대는 우주와 별에 대한 흥미를 유발하고, 과학적 호기심을 키울 수 있는 다양한 프로그램을 제공한다. 특히, 최신 천문 관측 장비와 함께 천체 관측이 가능하여, 방문객들은 실제로 별과 행성을 가까이에서 관찰할 수 있다. 또한, 다양한 전시와 체험 학습을 통해 천문학의 원리와 우주의 신비를 쉽게 이해할 수 있도록 돕는다. 인천어린이천문대는 어린이들뿐만 아니라 가족 단위로 방문하기에도 적합한 장소로, 우주에 대한 꿈과 상상력을 자극하는 특별한 경험을 선사한다. 이곳은 과학 교육의 장으로서, 미래의 과학자를 꿈꾸는 아이들에게 큰 영감을 준다."
3432261,12,인천업사이클에코센터,20241202115956,20241202120023,,,https://www.incheoneco.or.kr,,http://tong.visitkorea.or.kr/cms/resource/77/3431877_image2_1.jpg,http://tong.visitkorea.or.kr/cms/resource/77/3431877_image3_1.jpg,Type1,2,3,A02,A0203,A02030400,"인천광역시 미추홀구 매소홀로290번길 7 (학익동, 인천 업사이클 에코센터)",,22203,126.6553344944,37.4432128271,6,"인천업사이클에코센터는 도심 속에서 환경소양 교육, 3R(감량, 재사용, 재활용) 생활 교육, 자연생태 체험을 통합적으로 제공하는 환경문화 교육·체험 시설이다. 에코센터는 ""에코 플랫폼 구축을 통한 자원순환 사회 구현""이라는 비전을 바탕으로, 지속 가능한 공동체 실현과 환경 실천 문화를 확산하는 것을 목표로 하고 있다. 이를 위해 수요자 맞춤형 자원순환 교육 서비스를 확대하고, 물품 공유센터, 새활용 알맹가게, 캔·페트 수거기 등 시민들이 직접 이용 가능한 플랫폼을 운영하여 생활 속 자원순환 실천을 장려한다. 또한, 업사이클 기업 육성과 소재은행 확대를 통해 순환경제를 활성화하며, 시민들이 체감할 수 있는 쓰레기 ZERO 문화를 확산하고 있다. 나아가, 탄소중립을 위한 선도적인 자원순환 플랫폼을 구축하여 지역사회 환경 보호와 지속 가능한 발전을 위한 기반을 마련하고 있습니다. 에코센터는 시민, 기업, 단체와 협력하여 자원순환 사회를 향한 실질적인 변화를 만들어가고 있다."
3003517,12,인천일본풍거리,20230829151952,20240522153950,,,,,http://tong.visitkorea.or.kr/cms/resource/66/3001966_image2_1.jpg,http://tong.visitkorea.or.kr/cms/resource/66/3001966_image3_1.jpg,Type3,2,10,A02,A0203,A02030600,인천광역시 중구 관동1가,,22315,126.6208729040,37.4736725684,6,"1호선 인천역 근처에  있는 일본풍거리는 과거 일본인들이 거주했던 일본 조계지이다. 인천 속 작은 일본을 느낄 수 있는 거리이다. 근대에 지어진 일본식 목조주택이나 석조 건축물이 아직까지 보존되어 있기도 하고  외벽 모습만 일본풍으로 바꾼 건물들이 거리를 형성하고 있다. 개항초기 세워진 일본주택은  마찌야 형식(상점이 있는 목조주택)과  나가야 형식(단층 목조건물)이 주를 이루었으나 1930년대이후에는 문화주택이 인천 곳곳에도 세워졌다. 
현재 여러채가 관동과 신흥동에 남아있다. 일본풍 목조건물들은 현재 카페나 박물관, 전시관 등으로 개조되어 사용되고 있고 거리에서 토토로 간판이나 복고양이 입간판 등을 볼 수 있어 이채롭다. 일본식 연립주택인 나가야가옥을 연상하게 만드는 감성카페들도 많다.  일본풍 거리부터 주변 관광지를 도는 인력거 투어도 있어 차이나타운, 동화마을도 함께 둘러볼 수 있다."
945513,12,인천중구청(구 인천부 청사),20100205023743,20250318165835,,,"<a href=""https://itour.incheon.go.kr/ssst/ssst/detail.do?pgListMode=S&cotId=ITD21122817122642207"" target=""_blank"" title=""새창: 인천 중구 문화관광 홈페이지로 이동"">www.icjg.go.kr/tour</a>",0,http://tong.visitkorea.or.kr/cms/resource/66/3395966_image2_1.JPG,http://tong.visitkorea.or.kr/cms/resource/66/3395966_image3_1.JPG,Type3,2,10,A02,A0201,A02010700,인천광역시 중구 신포로27번길 80,,22315,126.6214950690,37.4736836892,6,"인천광역시 중구 관동에 위치한 인천 중구청 본관 건물은 인천의 주요 행정기관 청사로 활용되어 온 건물이다. 현재 중구청의 본관 건물은 개항 후 일본 영사관이 자리했던 곳에 1933년 인천부 청사로 건립되었다. 인천부 청사로 사용되다 광복 이후 경기도 인천시 청사로, 1981년부터는 인천직할시 청사로 사용되었다. 1985년 시청이 구월동으로 이전하면서부터는 중구 청사로 지금까지 사용되고 있다. 건립된 이후로 지금까지 인천의 대표적인 행정 중심지로서 역할을 해오고 있다. 건립 당시에는 2층이었는데, 1964년 3층으로 증축되었다. 전체적으로 1930년대 모더니즘 건축양식의 특징을 잘 보여주고 있다. 당시에는 증기난방과 더불어 수세식 화장실 등 최신 설비를 갖추어져 크게 주목받았다. 외관을 구성하고 있는 스크래치 타일은 현재 찾아보기 힘든데, 당시 건축물의 특징 지어주는 귀중한 자료로 역사적, 건축적 가치가 있다. 

(출처 : 인천 문화관광 홈페이지)"
2790502,12,인천중앙공원,20211209201148,20250327092434,,,"<a href=""https://www.incheon.go.kr/park/park010401"" target=""_blank"" title=""새창 : 인천의 공원 홈페이지로 이동"">https://www.incheon.go.kr/park/</a>",0,http://tong.visitkorea.or.kr/cms/resource/71/2791071_image2_1.JPG,http://tong.visitkorea.or.kr/cms/resource/71/2791071_image2_1.JPG,Type3,2,4,A02,A0202,A02020700,인천광역시 남동구 예술로 125 (구월동),,21568,126.6994331831,37.4456772082,6,"인천중앙공원은 인천광역시 남동구 구월동에 위치한 대규모 도시공원으로, 시민들에게 편안한 휴식과 여가를 제공하는 중요한 공간이다. 공원은 넓은 면적을 자랑하며, 다양한 시설과 자연경관을 갖추고 있어 방문객들에게 다양한 즐길 거리를 제공한다. 특히, 공원 중심에는 아름다운 호수가 있어 산책로를 따라 걸으며 자연을 만끽할 수 있다. 또한, 공원 내에는 자전거 도로, 운동 시설, 어린이 놀이공간 등 다양한 편의시설이 마련되어 있어 가족 단위 방문객들에게 인기가 많다. 계절마다 변화하는 풍경은 그 자체로 매력적이며, 특히 봄과 가을에는 아름다운 꽃과 단풍이 공원의 경관을 더욱 빛낸다. 인천중앙공원은 또한 각종 문화 행사와 축제의 장소로 사용되며, 주민들과 관광객들이 함께 즐길 수 있는 다양한 프로그램이 열린다. 이곳은 도심 속에서 자연을 즐기며 여유로운 시간을 보낼 수 있는 장소로, 많은 사람들이 자주 찾는 명소이다."
2999163,12,인천치즈스쿨,20230821134343,20241016134025,,,"<a href=""http://www.icheeseschool.co.kr/incheon.php"" target=""_blank"" title=""새창 : 홈페이지로 이동"">http://www.icheeseschool.co.kr</a>",,http://tong.visitkorea.or.kr/cms/resource/64/2999564_image2_1.jpg,http://tong.visitkorea.or.kr/cms/resource/64/2999564_image3_1.jpg,Type3,2,2,A02,A0203,A02030400,인천광역시 계양구 봉오대로 855 계양경기장,,21072,126.7443683688,37.5311014098,6,"계양 경기장에 위치한 인천치즈스쿨은 다양한 체험활동을 할 수 있는 체험학습장이다. 주로 어린이와 단체들을 대상으로 하고 있으며 어린이들이 직접 손으로 치즈가 되기까지의 과정을  체험하고, 치즈가 들어간 피자와 파스타등 다양한 음식을 요리하고 시식하며 치즈에 대한 흥미를 높이는 체험의 장이다. 중식으로 본인이 만든 피자를 먹고 스파게티와 음료는 제공된다.
치즈스쿨에서는 치즈 만들기 체험 이외에도 양궁, 뻥튀기 만들기, 투호, 굴렁쇠, 비눗방울, 워터건 체험 등 댜양한 야외 체험활동도 함께 하고 있어 체험 참여자들이 새로운 경험과 즐거움을 만끽할 수 있다."
1619527,12,인천항 갑문,20120430224718,20250327182716,,,"<a href=""http://www.icpa.or.kr/"" target=""_blank"" title=""새창: 인천항만공사 사이트로 이동"">http://www.icpa.or.kr</a>",0,http://tong.visitkorea.or.kr/cms/resource/61/1577661_image2_1.jpg,http://tong.visitkorea.or.kr/cms/resource/61/1577661_image3_1.jpg,Type3,2,10,A01,A0101,A01011400,인천광역시 중구 월미로 376,(북성동1가),22305,126.6036330015,37.4667897312,6,"인천항 갑문은 인천광역시 중구에 위치한 중요한 항만 시설로, 인천항의 선박 운항을 원활하게 지원하는 역할을 한다. 갑문은 배가 항구에 안전하게 입출항할 수 있도록 돕는 조수 간만의 차이를 조절하는 시설로, 특히 큰 선박들이 통과할 때 필수적인 구조물이다. 이 시설은 선박이 높은 조수나 낮은 조수에서 어려움 없이 항구를 오갈 수 있도록 물의 높이를 조절하며, 인천항의 효율적인 운영을 돕는다. 인천항 갑문은 또한, 항구의 안전성과 선박의 통행에 중요한 영향을 미치며, 국내외 무역에 필수적인 역할을 한다. 갑문을 통해 들어오는 다양한 선박들은 인천항을 통해 물류와 상업 활동을 활발히 이어가고 있으며, 이 시설은 인천항의 발전과 해상 물류에 기여하는 핵심적인 인프라로 자리 잡고 있다."
2554143,12,인천항 갑문홍보관,20180718185228,20250314163443,,,"<a href=""https://www.icpa.or.kr/content/view.do?menuKey=527&contentKey=64"" target=""_blank"" title=""새창 : 인천항만공사 홈페이지로 이동"">https://www.icpa.or.kr/</a>",0,http://tong.visitkorea.or.kr/cms/resource/39/3302939_image2_1.jpg,http://tong.visitkorea.or.kr/cms/resource/39/3302939_image3_1.jpg,Type3,2,10,A02,A0204,A02040800,인천광역시 중구 월미로 376,(북성동1가),22305,126.6041412796,37.4671063698,6,"인천항은 우리나라의 대표 항만시설 중 하나로써, 중국과 수도권 물류의 교류거점 역할을 담당하고 있다. 갑문이 있는 항구에는 5만 톤급의 대형선박도 입출항이 가능한 수출입 화물 전용부두가 운영되고 있다.
인천항 갑문홍보관은 인천항과 갑문의 발전역사와 미래비전을 제시하고 있으며, 갑문홍보영상, 갑문구동시뮬레이션, 각종 체험프로그램 등으로 구성되어 있다. 또, 인천항 갑문의 전경과 선박들이 갑문을 통항하는 모습을 감상할 수 있는 야외 공원 조성되어 있으며, 갑문과 내항의 전경 감상하고 원경을 통해서 원거리 경관 조망 가능한 전망대 등도 자리하고 있다."
