contentid,contenttypeid,title,createdtime,modifiedtime,tel,telname,homepage,booktour,firstimage,firstimage2,cpyrhtDivCd,areacode,sigungucode,cat1,cat2,cat3,addr1,addr2,zipcode,mapx,mapy,mlevel,overview
1114621,12,송현배수지제수변실,20101021030024,20240530102514,,,"▪ <a href=""http://www.cha.go.kr/"" target=""_blank"" title=""국가유산청 사이트로 이동"">http://www.cha.go.kr</a> <br>▪ <a href=""https://blog.naver.com/incheontogi/220989552453""target=""_blank"" title=""새창 : 인천시 공식블로그로 이동"">https://blog.naver.com/incheontogi</a>",0,,,,2,5,A02,A0201,A02010700,인천광역시 동구 송현공원로 75-21,(송현동),22541,126.6394266197,37.4789722796,6,"송현배수지는 인천 최초로의 상수도 시설이자 도시계획 시설로 1905년 중도(中島) 박사에 의해 경인수도 설계가 완성됨에 따라 1906년 11월 착공하여 1908년 준공되었다. 1910년 10월 노량진 수원지 정수시설이 준공되어 노량진과 인천 사이에 32.64km의 수도관이 설치되었고, 같은 해 12월 10일부터 급수를 시작했다. 
송현배수지는 부지면적 36,780㎡, 5,000㎡로 저수조 3개를 갖추고 있으며, 현재 이곳에서 급수받는 지역은 동구 일원 및 중구 일부 지역이다. 저수능력은 20,000톤으로 준공 당시와 비슷하다. 현존하는 배수지 건물로는 제수변실과 23단의 화강석으로 된 장대석 계단, 철제 정문 등이 있고, 정문은 화강석 초반 위에 콘크리트 기둥을 심고 4각 모양과 둥근 화강석의 주두로 이루어져 있다. 제수변실은 배수지에서 배수관의 단수 및 유압조절기능을 담당하는 제수밸브를 보호하는 시설물로서 원통형이며, 일체식 무근 콘크리트 구조로 되어있다."
264616,12,수기해변,20040903021354,20240605144239,,,"<a href=""http://www.ongjin.go.kr/open_content/tour/"" target=""_blank"" title=""옹진 문화관광 사이트로 이동"">http://www.ongjin.go.kr/</a>",0,,,,2,9,A01,A0101,A01011200,인천광역시 옹진군 북도면 시도로86번길 291-49,,23114,126.4311771590,37.5446026512,6,"수기해변은 영종도와 강화도 사이에 있는 총 면적 2.4㎢의 조그만 섬, 시도에 있다. KBS 인기 드라마 [풀하우스] 세트장이 있던 곳으로 드라마 풀하우스의 주 무대였으나 현재 세트장은 철거되었다. 평소엔 한적하고 여유로운 분위기이지만 주말과 연휴에는 가족 나들이객과 캠핑족들로 북적인다. 
해변은 아담하고 깨끗한 편이며, 화장실과 개수대, 파고다 등 여러 가지 시설들이 잘 갖춰져 있어 가족단위 야영객들이 즐겨 찾는 곳이다. 수기해변은 모래가 곱고 수심이 얕아 아이들이 놀기 좋고 바닷물이 밀려난 때에는 갯벌 체험도 가능하다. 시도까지는 영종도에서 페리를 타고 신도에 도착해 차나 자전거 등을 이용해 이동하면 된다. 시도는 신도, 모도와 연륙교로 연결되어 있어서 자동차를 타거나 걸어서 세 섬을 모두 구경할 수 있다. 갯벌을 돌아서 주변에 있는 배미꾸미 조각공원, 모도리 해안둘레길도 함께 볼 수 있다."
1325945,12,수도권매립지 야생화단지 드림파크,20110706235051,20250317173500,,,"인천투어 <a href=""https://itour.incheon.go.kr/ssst/ssst/detail.do?cotId=ITD21121610003503461""target=""_blank"" title=""새창: 인천투어 홈페이지로 이동 "">https://itour.incheon.go.kr/</a><br>드림파크문화재단<a href=""http://www.dreamparkcf.or.kr/sub/board.php?mn=business&fn=setting&gb=hana_board_89&bn=hana_board_89&zest_bn=hana_board_89"" target=""_blank"" title=""새창 : 드림파크문화재단 페이지로 이동"">http://www.dreamparkcf.or.kr/</a>",0,http://tong.visitkorea.or.kr/cms/resource/93/3304493_image2_1.jpg,http://tong.visitkorea.or.kr/cms/resource/93/3304493_image3_1.jpg,Type3,2,7,A02,A0204,A02040800,인천광역시 서구 거월로 61,,22688,126.6481593065,37.5732892425,6,"드림파크는 인천의 수도권매립지를 시민의 휴식공간으로 활용하는 대규모 생태녹지공간이다. 1992년부터 수도권 쓰레기를 매립하던 곳을 꽃과 나무가 무성한 야생화공원으로 조성하여 수도권 시민들의 산책과 휴식, 환경교육을 위한 장으로 거듭났다. 드림파크 야생화공원은 테마식물지구, 야생초화지구, 습지생태지구 등 주제에 따라 다양한 공간으로 구성되어 있으며, 약 300여 종의 식물이 식재되어 있어 편안하게 산책할 수 있는 휴식공간이다. 다양한 꽃으로 사계절이 아름다운 이곳은 5월에는 유채과 양귀비, 6~8월에는 라벤더, 9~11월에는 핑크뮬리 등이 피는 꽃밭을 조성하여 야생화 생태계를 보전하고 있다. 이밖에 연꽃과 벗풀, 창포 등이 있는 수생식물원, 그늘쉼터 등의 도심 휴식공간, 물 위를 걷는 징검다리길, 피톤치드 가득 상록수길 등 힐링 산책로, 사람과 사람이 만나는 테마광장을 조성하였다. 또, 내가 직접 가꾸고 돌보는 드림파크 정원교실과 손바닥정원, 나무인형 만들기 등 시민참여 프로그램도 진행하고 있다."
2768186,12,수도사(인천),20211104201154,20250407164952,,,"<a href=""http://www.sudosa.kr/"" target=""_blank"" title=""새창 : 수도사 사이트로 이동"">http://www.sudosa.kr/</a>",0,,,,2,3,A02,A0201,A02010800,인천광역시 미추홀구 구월로8번길 36-5,(주안동),22146,126.6932139980,37.4567424796,6,인천 주안동 석바위 시장 역 인근에 있는 사찰로 정식 명칭은 석암산 수도사이며 1967년 창건되었다. 사찰 뒤로 석바위 공원이 있어 도심 주택가에 위치하고 있지만 산중 사찰과 같은 자연환경을 품고 있다.  대웅전으로 올라가는 계단에 황금 동상으로 된 미륵존 여래불이 있다. 삼천불전과 삼성각 종각과 무량수전 등이 있고 사리탑과 여러 불상들이 모셔져 있다. 도심포교에 앞장서는 사찰로 불자들이 많이 찾는다.
127544,12,수봉공원,20031223090000,20241223091410,,,"미추홀구 문화관광포털<a href=""https://www.michuhol.go.kr/culture/tourist_attraction/view.do?sq=79167&depth1_cat_cd=&theme_cat_cd=003001001004&sq=79167&search=eyJ0aGVtZV9jYXRfY2QiOiIwMDMwMDEwMDEwMDQifQ=="" target=""_blank"" title=""새창: 미추홀구 문화관광포털 "">https://www.michuhol.go.kr/culture</a>",0,http://tong.visitkorea.or.kr/cms/resource/58/3030758_image2_1.jpg,http://tong.visitkorea.or.kr/cms/resource/58/3030758_image3_1.jpg,Type3,2,3,A02,A0202,A02020700,인천광역시 미추홀구 수봉안길 84,,22166,126.6633194142,37.4598915854,6,"수봉공원은 수봉산 자락에 조성된 인천의 대표적 공원이다. 어린이 놀이터와 자연학습장을 비롯해 궁도장, 배드민턴장, 테니스장, 농구장 등 다양한 시설을 갖추고 있다. 곳곳에 현충탑과 재일학도의용군 참전기념비, 인천지구 전적기념비 등 호국 정신을 담은 기념비들이 세워져 있으며 실향민들을 위한 망배단도 설치되어 있다. 언제나 크고 작은 공연을 감상할 수 있고 민속공연이 열리는 전통 민속놀이마당도 있다. 공원 내의 은율탈춤 전수관에서는 무형문화재 공연이 연중 개최된다. 수봉공원에 자리한 인공폭포는 높이 37m, 폭 122m로 국내 최대 규모이다. 상하 두 개로 이루어진 폭포 앞에는 다양한 공연이 열린다. 폭포 사이에는 두세 명이 걸을 수 있는 회랑이 있는데 폭포와 공원의 경관을 관망하기 좋다. 수봉공원은 특히 야경이 아름답다. 2018년 인천 야간 경관 10대 명소에 이름을 올렸을 만큼 아름다운 야경을 자랑한다."
3354017,12,술작가 양조장,20240826173816,20240828140942,,,"<a href=""https://www.meadhouse.co.kr/"" target=""_blank"" title=""새창 :술작가 양조장 홈페이지 이동"">www.meadhouse.co.kr</a>",,http://tong.visitkorea.or.kr/cms/resource/97/3353997_image2_1.png,http://tong.visitkorea.or.kr/cms/resource/97/3353997_image3_1.png,Type1,2,5,A02,A0203,A02030400,인천광역시 동구 금곡로 52 (금곡동),1층,22563,126.6413349348,37.4733674091,6,"술작가 양조장은 단순히 전통주를 빚어 판매하는 곳이 아닌 전통의 가치를 전파하는 곳이다. 양조장에서 술이 빚어지는 과정을 견학을 하고 나만의 특별한 술을 빚어보며, 여러 주종의 전통주를 맛보며 나의 취향을 찾아가고 구매까지 할 수 있는 특별한 여행지이다. 전통주를 빚으면 나오는 부산물로 리사이클링한 지게미 안주가 제공된다. 단체, 친구, 연인, 가족 단위의 예약제로 운영되고 있다."
3098891,12,스머프매직포레스트 송도점,20240213170242,20250318135731,,,"<a href=""https://www.smurfmagic.com"" target=""_blank"" title=""새창: 스머프 매직 포레스트 송도점 인스타그램 홈페이지로 이동"">https://www.smurfmagic.com/</a>",,http://tong.visitkorea.or.kr/cms/resource/87/3098887_image2_1.jpg,http://tong.visitkorea.or.kr/cms/resource/87/3098887_image3_1.jpg,Type3,2,8,A02,A0202,A02020600,인천광역시 연수구 하모니로 158 (송도동),,21998,126.6427567492,37.3831445820,6,"스머프 매직 포레스트는 세계적인 캐릭터인 스머프의 벨기에 본사와 스머프 매직 포레스트 제작 팀이 함께 협업하여 만든 세계 최초의 도심형 테마파크이다. 내부는 스머프 마술쇼 어트렉션, 스머프 굿즈샵으로 나누어져 있으며, 남녀노소 누구나 즐길 수 있는 다양한 볼거리와 즐길거리를 제공한다. 파파스머프의 마법실험실은 5평 남짓한 프라이빗룸 안에서 약 70분 간 마술쇼와 미디어 아트 인터렉션과 미션 퀴즈가 결합되어 펼쳐지는 체험형 어트렉션이다. 스머프 매직 포레스트 제작팀이 최신 미디어 인터렉션 기술을 통하여 직접 제작한 개구쟁이 스머프와의 글로벌 콜라보레이션 프로젝트를 체험할 수 있다. 직접 스머프가 되어 펼쳐보는 놀라운 마법체험을 할 수 있는 테마파크다."
2496314,12,승봉도,20170619232133,20250319145313,,,"<a href=""https://itour.incheon.go.kr/ssst/ssst/detail.do?pgListMode=S&cotId=ITD21121617201613777"" target=""_blank"" title=""새창 : 홈페이지로 이동"">https://itour.incheon.go.kr/</a>",0,http://tong.visitkorea.or.kr/cms/resource/94/3350994_image2_1.jpg,http://tong.visitkorea.or.kr/cms/resource/94/3350994_image3_1.jpg,Type3,2,9,A01,A0101,A01011300,인천광역시 옹진군 자월면 승봉리,,23127,126.3087319826,37.1665472227,6,"승봉도는 아득한 옛날에 신 씨와 황 씨가 고기를 잡던 중 풍랑을 만나 대피한 곳으로써, 며칠 동안 굶주린 시장기를 달래기 위하여 섬의 이곳저곳을 둘러보니 경관도 좋고 산새도 괜찮아 사람이 살 수 있는 곳이라 판단되어 정착하였다고 전해지는 섬이다. 이곳의 지형이 마치 봉황이 하늘을 올라가는 모양과 같다 하여 ‘승봉’이라 부른다고 한다. 승봉도는 인천과 가까운 거리로 힐링여행지로 최적의 섬이다. 해안산책로 주변으로 자생해송림이 넓게 분포되어 산림욕을 즐길 수 있으며, 촛대바위와 남대문 바위 등을 만날 수 있어 가벼운 트래킹을 즐기기에 좋다. 또한 섬 남쪽에 위치한 이일레해변은 백사장의 경사가 완만하고, 수심이 낮아 관광객들이 물놀이를 위해 주로 찾는 해변이다."
125498,12,승봉도 이일레 해변,20031208090000,20250319152305,,,"<a href=""https://itour.incheon.go.kr/areatour/areatour/detail.do?cotId=APD21112609180822089"" target=""_blank"" title=""새창 : 홈페이지로 이동"">https://itour.incheon.go.kr/</a>",0,http://tong.visitkorea.or.kr/cms/resource/29/3355829_image2_1.jpg,http://tong.visitkorea.or.kr/cms/resource/29/3355829_image3_1.jpg,Type3,2,9,A01,A0101,A01011200,인천광역시 옹진군 자월면 승봉로116번길,,23127,126.3012771320,37.1655916496,6,"승봉도는 인천 연안부두에서 서남방으로 약 50km 떨어진 섬이다. 섬 전체의 마치 하늘을 비상하는 봉황을 닮았대서 승봉도(昇鳳島)라는 이름이 붙었다고 한다. 이일레 해변은 이 섬의 남쪽 해안에 있는 해수욕장으로 길이 1,300m, 폭 40m 정도의 백사장은 경사가 완만하고 수심도 낮다. 그래서 간조 때에도 갯벌이 전혀 나타나지 않는다. 모래사장 뒤로 울창한 숲이 펼쳐져 있어 시원한 분위기를 자아내며, 한적한 장골해수욕장과도 가깝다. 또한 넓은 공한지가 있어 단체로 오는 방문객들에게도 좋은 여건을 제공하고, 승봉도 유일의 마을은 옹진군 농업기술센터가 육성하는 향토 관광마을이다. 이곳은 민박 시설이 잘 갖춰져 있을 뿐만 아니라 하루 400여 톤의 지하수 물을 퍼올려 사용하는 샤워장이 피서객들에게 깊은 인상을 남긴다."
3417059,12,승봉도 해안산책로,20241115111551,20250319141510,,,,,,,,2,9,A01,A0101,A01010500,인천광역시 옹진군 자월면 승봉리,5,23127,126.3180118549,37.1605508559,6,"승봉도 해안산책로는 인천광역시 연수구 자월면 승봉도에 위치한 아름다운 자연경관을 자랑하는 산책로이다. 이곳은 해안선을 따라 이어지는 길로, 시원한 바다 바람과 함께 걷기 좋은 코스를 제공한다. 산책로를 따라 걸으며, 넓은 바다와 울창한 숲을 동시에 즐길 수 있어 방문객들에게 평화롭고 여유로운 시간을 선사한다. 승봉도 해안산책로는 부두치 해변부터 촛대바위까지 나무데크로 이어져 있다. 약 40분간 해안을 따라 걷는 코스로 이뤄져 있으며 푸른 바다를 보며 섬을 즐길 수 있다. 부두치 해변 끝에는 묵섬을 볼 수 있어 바닷물이 빠지면 직접 건너가 구경할 수 있다."
2782190,12,승봉도선착장,20211126233612,20250327162836,,,,0,http://tong.visitkorea.or.kr/cms/resource/40/2786740_image2_1.jpg,http://tong.visitkorea.or.kr/cms/resource/40/2786740_image3_1.jpg,Type3,2,9,A01,A0101,A01011400,인천광역시 옹진군 자월면 승봉로 19,,23127,126.2919417508,37.1700465271,6,"승봉도선착장은 승봉도를 찾는 여행객들에게 중요한 관문 역할을 하며, 여객선이 자주 왕래한다. 승봉도는 아름다운 자연경관과 조용한 분위기로 유명한 섬으로, 이 선착장에서 내려 승봉도의 다양한 관광지와 자연을 쉽게 탐방할 수 있다. 선착장 주변은 깨끗하게 관리되어 있으며, 여유로운 분위기에서 배를 기다리거나 바다를 바라보며 시간을 보낼 수 있다."
3078306,12,승봉산림욕장,20231129161819,20240103150051,,,,,,,,2,9,A01,A0101,A01010600,인천광역시 옹진군 자월면 승봉리,산49-2,23127,126.3107290732,37.1647085817,6,"봉황이 하늘로 올라가는 모양과 흡사하다하여 승봉도라 불렀다고 전해진다. 승봉도는 인천과 가까워 당일치기 나들이하기에 좋은 섬이다. 
당산으로 오르는 입구에 있는 승봉산림욕장은 경사가 거의 없어 누구나 가볍게 걷기 좋은 코스이다. 바닷바람을 맞고 자란 울창한 소나무 숲의 맑고 상쾌한 공기를 마시며 걷다가 중간중간 운동기구에서 운동도 하고 정자에 앉아 쉴 수도 있다. 산림욕장을 통하면 산의 정상까지 갈 수 있으며, 목섬과 촛대바위 방향으로도 길이 나 있다. 부두치해변에서 촛대바위까지의 해안산책로도 데크길이 길게 이어져 있어 관광객이 많이 찾는다.
주변에 승봉산림욕장, 남대문바위, 촛대바위, 이일레 해변, 해안산책로, 목섬 등이 있어 함께 둘러볼 수 있다."
2767546,12,승학체육공원,20211103184933,20250327104920,,,"<a href=""https://www.michuhol.go.kr/main/public_sports/list.do?theme_cat_cd=003001009005"" target=""_blank"" title=""새창 : 홈페이지로 이동"">https://www.michuhol.go.kr/main/main.do</a>",0,http://tong.visitkorea.or.kr/cms/resource/86/2780986_image2_1.png,http://tong.visitkorea.or.kr/cms/resource/86/2780986_image2_1.png,Type3,2,3,A02,A0202,A02020700,인천광역시 미추홀구 주안동,273,22231,126.6804128152,37.4413523746,6,"승학체육공원은 인천 미추홀구 승학산 중턱에 자리 잡은 1만 5000㎡ 면적의 체육공원으로 다양한 경기장과 산책로를 갖추고 있다. 인조잔디가 깔린 축구장과 바닥 공사가 잘 되어 있는 농구장과 풋살장, 또 전용 트랙을 갖춘 인라인스케이트장이 있으며, 공원을 오르는 나무 데크 산책로와 울창한 나무들 사이로 펼쳐진 조깅코스가 있다. 지역 주민들의 건강과 생활 체육의 활성화를 위해 미추홀 구청에서 마련한 다양한 프로그램이 진행되고 있다. 풋살장(축구장)은 전화로 예약하고 사용할 수 있다."
2768099,12,신도선착장,20211104191303,20250327163235,,,,0,http://tong.visitkorea.or.kr/cms/resource/12/2787912_image2_1.jpg,http://tong.visitkorea.or.kr/cms/resource/12/2787912_image3_1.jpg,Type3,2,9,A01,A0101,A01011400,인천광역시 옹진군 북도면 신도리 523-58,,,126.4392855613,37.5152478762,6,"영종도와 마주하고 있는 신도는 영종도의 삼목선착장에서 신도바다역 여객터미널까지 바다로 오간다. 장봉도와는 신도선착장에서는 바닷길을 통해 배를 타고 오간다. 삼형제섬이라 하여 신도와 그 옆에 있는 작은 섬 시도와 모도는 다리로 연결되어 있는데 신도선착장은 이들 섬으로 가기 위해 드나드는 관문이다. 선착장 주변에는 바다를 바라보며 여유로운 시간을 보낼 수 있는 공간이 마련되어 있으며, 여객선 탑승 전 후에 휴식을 취할 수 있다."
2767752,12,신석체육공원,20211103225246,20250312092307,,,"<a href=""https://park.poscointl.com/_service/main.asp"" target=""_blank"" title=""새창 : 신석체육공원 사이트로 이동"">https://park.poscointl.com/_service/main.asp</a>",0,http://tong.visitkorea.or.kr/cms/resource/64/2784564_image2_1.png,http://tong.visitkorea.or.kr/cms/resource/64/2784564_image2_1.png,Type3,2,7,A02,A0202,A02020700,인천광역시 서구 길주로 39,(석남동),22788,126.6656206463,37.5079165993,6,인천 서구 석남동에 위치한 체육공원으로 포스코에너지㈜가 인천시민의 건강과 여가 생활 증진을 위해 조성한 곳이다. 인조 잔디가 있는 축구장 1면과 인조 잔디로 된 풋살장 1면이 있다. 또한 족구장 1면과 농구장 2면의 시설을 갖추고 있다. 이 외에도 어린이 놀이터 및 운동 시설이 있으며 운동장은 선착순 온라인 예약제로 운영되고 있다. 예약은 포스에너지 홈페이지 예약페이지를 통해 접수할 수 있다. 체육공원 주변으로 벚나무가 식재되어 봄이면 벚꽃을 감상하려는 사람들의 산책 코스로도 인기가 많다.
2024639,12,신시모도 (신도ㆍ시도ㆍ모도),20150821190336,20250314141722,,,"<a href=""https://www.ongjin.go.kr/open_content/tour/#"" target=""_blank"" title=""새창 : 옹진문화관광 홈페이지로 이동"">https://www.ongjin.go.kr</a>",0,http://tong.visitkorea.or.kr/cms/resource/79/2661879_image2_1.jpg,http://tong.visitkorea.or.kr/cms/resource/79/2661879_image2_1.jpg,Type3,2,9,A01,A0101,A01011300,인천광역시 옹진군 북도면,"신도리, 시도리, 모도리",,126.4253141031,37.5338426900,6,"신도, 시도, 모도는 연도교로 이어져 신·시·모도 삼형제 섬이라고도 불리며, 세 개의 섬을 한 번에 둘러볼 수 있는 색다른 묘미가 있다. 특히, 섬과 섬 사이를 달리는 자전거 여행이 인기를 끌고 있으며, 구봉산, 해당화둘레길, 수기해변, 배미꾸미조각공원 등 각양각색의 매력을 지닌 관광지에서 가족, 연인과 다양한 추억을 만들 수 있다. 

신도는 섬 주민들의 착하고 신의가 있다는 뜻에서 유래된 섬으로 구봉산이 유명하다. 임도를 따라 등산로가 완만하게 잘 정비되어 있으며 진달래와 벚꽃이 즐비하다. 또한, 구봉정에서는 서해의 풍광이 한눈에 들어오며, 인천공항과 인천 도시의 야경은 특히 아름답다.

시도는 산과 바다가 조화롭게 빚어내는 아름다운 경치 때문에 풀하우스, 슬픈연가 등 인기 드라마의 배경이 되었다. 수기해변은 완만하고 넓은 백사장으로 마니산이 지척으로 보이며, 방죽길을 따라 펼쳐진 해당화가 일품이다. 시도는 마니산에서 활을 쏠 때, 그 목표지점이어서 ‘살섬’이라 불렀다는 이야기가 있다. 시도와 모도 연도교를 지나 해당화 길을 따라가면 모도의 배미꾸미해변이 나온다. 조각가 이일호의 조각 작품과 바다가 만들어내는 신비로운 분위기 때문에 연인들이 많이 찾는다. 

모도는 그물에 고기는 올라오지 않고 띠(茅)만 걸린다고 해서 한글로 ‘띠염’이라 부르던 이름이 한자로 바뀌었다고 한다."
126568,12,신트리공원(인천),20031120090000,20250404155809,,,"<a href=""https://www.icbp.go.kr/tour/locinfo/park/parkDetail.do?loc_seq=5251&order=view&keyword=%EC%8B%A0%ED%8A%B8%EB%A6%AC%EA%B3%B5%EC%9B%90&listsz=10"" target=""_blank"" title=""새창 : 홈페이지로 이동"">https://www.icbp.go.kr</a>",0,http://tong.visitkorea.or.kr/cms/resource/73/3030773_image2_1.jpg,http://tong.visitkorea.or.kr/cms/resource/73/3030773_image3_1.jpg,Type3,2,6,A02,A0202,A02020700,인천광역시 부평구 신트리로 21,,21354,126.7266067880,37.5064928445,6,"신트리공원은 인천시 부평구를 대표하는 공원 가운데 하나로 신기리라는 마을 이름에서 유래한 것으로 알려진다. 정문 입구에 여러 마리의 백마 상이 서 있는 분수대가 있어 백마공원이라고 불리기도 한다. 공원은 총 면적 58,594㎡로 축구장, 테니스장, 배드민턴장 및 어린이들이 마음껏 뛰어 놀 수 있는 어린이 놀이터와 산책로, 분수대 등이 있다. 공원 안에 인천광역시 교육청 북구 도서관이 있다."
2767879,12,신항 바다쉼터,20211103234939,20250327150350,,,,0,http://tong.visitkorea.or.kr/cms/resource/11/2781411_image2_1.png,http://tong.visitkorea.or.kr/cms/resource/11/2781411_image2_1.png,Type3,2,8,A01,A0101,A01011100,인천광역시 연수구 송도동 386-4,(송도동),21992,126.6147770099,37.3453234810,6,"인천해양수산청이 송도 1동 988-3 일원에 신항 바다쉼터를 조성하여 2011년 6월부터 현재까지 시민들에게 개방하고 있다. 군사보호 구역임에도 인천 신항 건설과 함께 개장한 바다쉼터는 시민들이 인천항의 발전 모습과 서해의 아름다움을 보고 휴식을 취할 수 있도록 제공한 것이다. 방파제와 그 위로 조성된 산책로와 전망대가 있으며 쉼터가 마련되어 있고, 해안가 주변으로 지압판이 깔린 산책길이 조성되어 있다."
2767625,12,실미도,20211103200446,20250327174526,,,"<a href=""https://itour.incheon.go.kr/ssst/ssst/detail.do?pgListMode=S&cotId=ITD21123009344247067"" target=""_blank"" title=""새창 : 홈페이지로 이동"">https://itour.incheon.go.kr/</a>",0,http://tong.visitkorea.or.kr/cms/resource/54/2781054_image2_1.jpg,http://tong.visitkorea.or.kr/cms/resource/54/2781054_image2_1.jpg,Type3,2,10,A01,A0101,A01011300,인천광역시 중구 무의동 산 361-5,,,126.3912903134,37.4008047931,6,"영종도 하단 무의도의 부속 섬인 무인도이다. 영화 ‘실미도’로 유명해 인지도가 높은 섬이다. 면적은 250,810㎡, 둘레는 6km에 이르며 무의도와는 하루 2번 썰물 때 개펄로 연결된다. 실미도는 1968년 중앙정보부가 창설한 북파 부대원 31명이 3년 4개월 동안 지옥훈련을 했던 장소였다. 이후 실미도의 실상을 파헤친 백동호의 소설 ‘실미도’가 발표된 후 강우석 감독의 영화 ‘실미도’가 2003년 개봉하면서 역사적 사실이 알려지게 되었다. 지금은 무의대교를 통해 자동차를 타고 역사의 현장을 직접 느껴보기 위해 많은 사람이 실미도를 찾고 있으며, 차박 캠핑지로도 인기 있다."
