contentid,contenttypeid,title,createdtime,modifiedtime,tel,telname,homepage,booktour,firstimage,firstimage2,cpyrhtDivCd,areacode,sigungucode,cat1,cat2,cat3,addr1,addr2,zipcode,mapx,mapy,mlevel,overview
2606297,12,덕적군도,20190613181102,20250327154405,,,"<a href=""https://itour.incheon.go.kr/ssst/ssst/detail.do?pgListMode=S&cotId=ITD22012517101819417"" target=""_blank"" title=""새창 : 홈페이지로 이동"">https://itour.incheon.go.kr/</a>",0,,,,2,9,A01,A0101,A01011300,인천광역시 옹진군 덕적면 문갑리,,23132,126.1117803784,37.1706405843,6,"인천의 서남쪽 약 8.2㎞ 지점에 있다. 덕적도를 비롯하여 소야도(蘇爺島), 문갑도(文甲島), 선갑도(仙甲島), 굴업도(掘業島), 선미도(善尾島), 백아도(白牙島), 울도(蔚島) 등으로 구성되어 있다. 덕적군도는 최북서단에 있는 선미도를 기점으로 하여 남동으로 거의 일렬로 산재하는 섬들인데 비교적 험준한 지형으로 이루어져 있다. 그러나 면적(21.9㎢)에 비하여 해안선의 굴곡이 심하고, 곳곳에 소만입이 발달, 소형 선박의 출입이 가능하다. 연안에는 간석지가 넓게 분포하여 간조시에는 육지가 된다. 기후는 해안 도서 지방이기는 하나 해양의 영향이 크지 않아, 기온의 연교차가 비교적 큰 대륙성기후의 특징이 나타난다. 특히, 겨울철에는 북서계절풍이 강하고 눈이 많이 내리며, 같은 위도의 동해안에 비하면 연평균기온이 2∼3℃ 정도 낮은 편이다."
125504,12,덕적도 갈대 군락지,20031208090000,20250327155249,,,"<a href=""http://www.ongjin.go.kr/open_content/tour/information/island_deokjeok.jsp?cate1=deokjeok&cate2=08#none"" target=""_blank""   title=""덕적도 갈대 군락지 홈페이지로 이동"">www.ongjin.go.kr</a>",0,http://tong.visitkorea.or.kr/cms/resource/02/2676402_image2_1.jpg,http://tong.visitkorea.or.kr/cms/resource/02/2676402_image2_1.jpg,Type3,2,9,A01,A0101,A01011300,인천광역시 옹진군 덕적면 덕적북로 130,,23130,126.1446675185,37.2276262006,6,"인천광역시 옹진군에 속한 덕적도는 서해 최대 규모의 갈대 군락지와 배낭 여행하기 좋은 비조봉 코스로 유명하다. 반짝이는 물결을 따라 살랑거리는 금빛 갈대의 리듬에 맞춰 군락지를 걸어보면 가을을 만끽하기에 충분하다. 비조봉 정상에는 팔각정 조망대가 있어 배낭여행을 즐기기에 좋으며, 이곳에서는 일몰과 일출을 모두 볼 수 있고 고개만 들면 둥근 보름달과 반짝이는 별을 파노라마로 바라볼 수 있어 가을의 낭만적인 분위기를 한껏 더 느낄 수 있다. 덕적도는 육지에서 1시간 정도 소요되는 비교적 가까운 거리에 있어 당일치기나 1박 2일 여행을 즐기기에도 좋다."
2664745,12,덕적도 능동자갈마당,20200723190149,20250314145815,,,"<a href=""http://www.ongjin.go.kr/open_content/tour/""target=""_blank"" title=""새창: 옹진군 문화관광"">http://www.ongjin.go.kr/</a>",0,,,,2,9,A01,A0101,A01011200,인천광역시 옹진군 덕적면,,23129,126.1024452213,37.2705482693,6,"서해 최대의 갈대 군락지를 보러 가는 것 만으로도 충분한 가치가 있으며 기암괴석과 크고 작은 자갈의 해변에서 보는 낙조 또한 일품이다. 해변가에는 자갈이 가득한데, 일반 몽돌해변의 자갈들보다 크기가 큰 편이다. 자갈에 파도가 부딪히는 소리가 청아하다. 바다와 어우러지는 주변 풍광 또한 아름답기로 유명하다."
2664734,12,덕적도 비조봉,20200723185016,20250314144530,,,"<a href=""https://www.ongjin.go.kr/open_content/tour/locinfo/tour.do?act=detail&loc_seq=108&order=view""target=""_blank"" title=""새창: 옹진군 문화관광"">http://www.ongjin.go.kr/open_content/tour/</a>",0,http://tong.visitkorea.or.kr/cms/resource/45/2799645_image2_1.jpg,http://tong.visitkorea.or.kr/cms/resource/45/2799645_image2_1.jpg,Type3,2,9,A01,A0101,A01010400,인천광역시 옹진군 덕적면,,23130,126.1299135279,37.2194907809,6,"덕적도에 위치한 비조봉(292m)은 정상까지 오르는데 약 2시간~2시간 30분 정도 소요된다. 정상에서 보는 탁 트인 산과 바다의 풍경은 가슴을 시원하게 한다. 백아도, 문갑도, 흑도, 굴업도가 한눈에 보인다. 최적의 등산코스로 등산객들이 즐겨 찾는 산이며 정상에서 볼거리가 풍부하다."
2537187,12,도래미마을,20180221202415,20250314093816,,,"<a href=""http://www.doraemi.kr/""target=""_blank"" title=""새창: 도래미마을 "">http://www.doraemi.kr/</a>",0,http://tong.visitkorea.or.kr/cms/resource/96/3352096_image2_1.jpg,http://tong.visitkorea.or.kr/cms/resource/96/3352096_image3_1.jpg,Type3,2,1,A02,A0203,A02030100,인천광역시 강화군 선원면 해안동로 1129-19,,23042,126.5091208399,37.7152063663,6,"강화군 선원면에 위치한 도래미 마을은 대몽항쟁 당시 팔만대장경의 판각을 맡았던 선원, 군사요충지로서 중요한 역할을 한 용진진, 화도돈대, 용당돈대, 그리고 장어요리로 유명한 더리미 장어마을 등 문화, 역사, 자연이 한데 어우러진 아름다운 농촌마을이다. 강화도에는 예로부터 농사짓는 사람들에게 이런 말이 있다. ＂강화 1년 농사면, 3년 흉년도 걱정 없다.＂ 강화도의 풍성함을 단적으로 보여주는 말이다. 그만큼 사는 사람들의 마음도 풍성하다. 아름다운 풍경과 더불어 시골의 여유가 묻어나는 강화 도래미 마을에서 행복함을 한껏 충전해 갈 수 있다."
3336134,12,독독,20240722230208,20241206083844,010-3736-1763,김성규,"<a href=""https://www.instagram.com/dogdog_0022/"" target=""_blank"" title=""독독 사이트로 이동"">https://www.instagram.com/dogdog_0022/</a>",,,,,2,10,A02,A0203,A02030400,인천광역시 중구 공항서로 517 (남북동),,22384,126.4015127827,37.4590370890,6,"독독은 인천공항 T1, T2 중간에 위치한 프리미엄 애견호텔, 애견유치원, 펫 스타디움, 펫 치유센터이다. 국내 최초로 김포공항 내부에 입점하였으며, 100% 예약제로 이용 가능하다. 1,200평 공간에 넓은 놀이터 6개가 구비되어 있다. 야외 잔디 놀이터에서는 목줄 없이 자유롭게 뛰어놀 수 있으며, 날씨가 안 좋을 경우, 70평이 넘는 실내 스타디움 놀이터를 이용할 수도 있다. 그 외 반려견 성향에 따른 맞춤형 케어 및 다양한 어질리티 프로그램 등이 다양하게 준비되어 있다."
2661510,12,"동검도(나들길,캠핑,예술극장)",20200630183218,20240508161337,,,"* <a href=""https://itour.incheon.go.kr/ssst/ssst/detail.do?pgListMode=S&cotId=APD21112609190826099"" target=""_blank"" title=""새창: 홈페이지로 이동"">https://itour.incheon.go.kr</a><br>* <a href=""https://blog.naver.com/incheontogi/222008457572"" target=""_blank"" title=""새창: 인천광역시 공식블로그로 이동"">https://blog.naver.com/incheontogi</a>",0,http://tong.visitkorea.or.kr/cms/resource/07/2661507_image2_1.jpg,http://tong.visitkorea.or.kr/cms/resource/07/2661507_image2_1.jpg,Type3,2,1,A01,A0101,A01011300,인천광역시 강화군 길상면 동검길63번길 60,,23053,126.5184012196,37.5913626272,6,"강화나들길은 총 20개의 코스로 이루어져 있는데, 그중 동검도는 강화나들길 8번 코스에 해당하는 강화도 본섬과 연결되어 있다. 동쪽의 검문소라는 뜻을 가지고 있는 동검도는 가운데 산지가 솟아 있고, 동북쪽과 서쪽 해안은 비교적 경사가 완만한 지형을 이룬다. 거대한 연안 갯벌에 둘러싸이고 포구를 따라 갈대밭이 무성한 신비로운 섬이다. 
면적이 여의도보다 작은 동검도는 캠핑으로 유명한 곳으로, 여러 곳에 캠핑장이 위치하고 있어 카라반, 텐트 등에서 노을 낙조를 즐길 수 있다. 그리고 섬 북동쪽에 자리한 DRFA365예술극장은 1년 365일 예술영화만 상영하는 영화관으로 섬을 대표하는 관광명소이다. 영화사에 길이 남을 명작 영화를 선정하여 매일 1~3편씩 상영한다."
2768096,12,동검선착장,20211104190842,20250326165021,,,,0,,,,2,1,A01,A0101,A01011400,인천광역시 강화군 길상면 동검길65번길 91-9,,23053,126.5219593359,37.5874659214,6,"강화도에 딸린 섬 동검도에 위치한 선착장 동검항이다. 이곳은 자동차로 캠핑을 즐기는 차박 장소로 유명한 곳이다. 강화도에서도 배를 타고 들어가지 않고, 강화도와 연결된 자동차 길로 이동할 수 있는 편리함 때문에 동검도는 자동차 캠핑장으로 인기가 높다. 서해안의 갯벌 체험과 주변 낚시터들도 이용할 수 있어 가족단위 캠핑족들이 많이 찾는다."
3061207,12,동구 어린이 교통공원,20231128173449,20240829091908,,,"<a href=""https://www.icdonggu.go.kr/main/community/experience/traffic.jsp"" target=""_blank"" title=""새창 : 홈페이지로 이동"">https://www.icdonggu.go.kr</a>",,http://tong.visitkorea.or.kr/cms/resource/41/3001341_image2_1.jpg,http://tong.visitkorea.or.kr/cms/resource/41/3001341_image3_1.jpg,Type3,2,5,A02,A0202,A02020700,인천광역시 동구 송림동,297-2,22561,126.6700905180,37.4779173883,6,"동구어린이교통공원은 아이들이 체험을 통해 교통질서와 문화, 안전수칙 등을 알기 쉽게 배울 수 있도록 조성한 교육시설로 실내체험관과 교통교육장으로 나뉘어있다. 실내체험관에서는 횡단보도 건너기, 통학버스 체험 및 자전거 킥보드 체험 등을 통해 안전사고 예방법을 배우고, 이와 관련한 3D 입체영상을 관람할 수 있다. 실외교통교육장은 실물과 똑같이 만든 교통시설을 어린이들의 눈높이에 맞춰 설치해 교육한다. 횡단보도, 자전거트랙 등을 실제 도로와 비슷하게 꾸민 체험공간은 현장감 있는 교육환경을 제공한다. 이곳에서 아이들은 횡단보도를 안전하게 건너는 방법과 상황 대처 요령을 배울 수 있다. 교차로와 자전거 전용 도로, 통행금지 등 교통안전 표지들도 한눈에 보기 좋게 배열되어 있다. 모노레일을 타고 교통공원을 한바퀴 돌아볼 수도 있고, 놀이터에서 잠시 휴식을 취할 수 있다. 모든 교육은 온라인과 전화예약으로 운영된다."
735753,12,동인천 삼치거리,20090518193206,20240523114106,,,"인천투어 <a title=""새창 : 인천투어 사이트로 이동"" href=""http://itour.incheon.go.kr"" target=""_blank"">hthttp://itour.incheon.go.kr</a><br />중구 문화관광 <a title=""새창 : 중구청 삼치거리 소개페이지로 이동"" href=""http://www.icjg.go.kr/tour/cttu0207a01"" target=""_blank"">http://www.icjg.go.kr/</a><br>",0,,,,2,10,A02,A0203,A02030600,인천광역시 중구 우현로67번길 57,(전동),22316,126.6286721359,37.4757224674,6,동인천삼치거리는 인천 관광 100선에 선정된 유명한 먹자골목으로 2002년도에 음식특화거리로 지정되었다. 인천광역시 교육청 학생교육 문화회관 옆에 곧게 뻗은 거리를 따라 가게들이 죽 늘어서 있다. 처음 인하의 집이라는 식당이 문을 열었는데 여러 메뉴 가운데 삼치가 가장 인기가 많다 보니 자연스럽게 삼치구이가 대표 메뉴가 되었고 인하의 집이 지금의 장소로 자리를 옮긴 이후 골목에 하나둘씩 삼치구이 식당들이 들어서 오늘날의 삼치거리가 형성됐다. 현재 약 13개 음식점이 영업하고 있으며 동인천 삼치거리에는 삼치구이와 막걸리 한 잔이라는 말이 나올 정도로 이 거리의 삼치구이는 특별한 양념이 없는데도 간이 적당히 배어 있어 안줏감으로 최고라고 한다.
2768117,12,동인천역 북광장,20211104193009,20250327103830,,,,0,,,,2,5,A02,A0202,A02020700,인천광역시 동구 화도진로 53 (송현동),,22550,126.6319301493,37.4765252097,6,"인천 동구 송현동에는 동인천역 북광장이, 중구 인현동에는 동인천역 남광장이 조성되어 있다. 인천 근대로 발자취 여행의 시작점이기도 한 북광장에는 사면으로 열린 광장문 건축물이 있다. 광장 주변으로 다양한 조각품들이 전시되어 있으며, 겨울이면 대형 크리스마스트리를 장식하여 시민들에게 멋진 야경을 선사한다. 동인천역 북광장에는 많은 시민들과 예술 애호가들이 소통하고 함께 즐길 수 있는 컨테이너형 복합 문화예술공간인 동인천 아트큐브가 있다. 안내소와 공연 연습실 2개 동, 전시동으로 이루어져 있으며, 누구나 예약하여 이용할 수 있다."
3457335,12,두리생태공원,20241223115628,20241223115651,,,,,http://tong.visitkorea.or.kr/cms/resource/64/3455864_image2_1.jpg,http://tong.visitkorea.or.kr/cms/resource/64/3455864_image3_1.jpg,Type1,2,2,A01,A0101,A01010500,인천광역시 계양구 당산길 291-20 (귤현동),,21010,126.7563328792,37.5690944266,6,"굴포천과 아라뱃길이 만나는 지점에 자리 잡고 있어, 다양한 생물들이 서식하는 습지 생태계를 간직하고 있다. 망원경을 통해 다양한 새들을 관찰하고, 습지에 서식하는 다양한 생물들을 만나볼 수 있다. 또한 곤충 채집, 식물 관찰 등 다양한 자연 체험 프로그램에 참여할 수 있다."
2767760,12,드림파크 주민체육공원,20211103225535,20250327112522,,,"<a href=""https://www.slc.or.kr/slc/mb/dp/athPark.do#/eyJ3ZWJQYWdlTm8iOiIyMDEiLCJ0YWJObyI6MH0="" target=""_blank"" title=""새창 : 수도권매입지관리공사 홈페이지로 이동"">https://www.slc.or.kr/main.do</a>",0,http://tong.visitkorea.or.kr/cms/resource/43/2780543_image2_1.png,http://tong.visitkorea.or.kr/cms/resource/43/2780543_image3_1.png,Type3,2,7,A02,A0202,A02020700,인천광역시 서구 왕길동 581-15,,,126.6391625652,37.5855043289,6,"드림파크 주민체육공원은 수도권매립지 주변영향권 지역주민들의 건강증진과 여가선용을 도모하기 위하여 건설된 공원이다. 인조잔디축구장, 인라인트랙, 배구, 농구, 테니스장 등의 운동시설뿐만 아니라 산책로, 어린이놀이터, 생태습지 및 친수경관연못 등 다양한 시설이 설치되어 있어 운동애호가 및 단체, 가족단위 이용객들에게 큰 인기를 얻고 있다. 다만 축구장은 영향권지역에 거주하는 주민만 이용이 가능하다. 축구장과 테니스장 이용을 하고 싶다면 수도권매입지관리공사에 직접 방문하여 서류 제출 및 단체 등록 신청을 해야 한다."
125468,12,마니산(강화),20060302090000,20240510091816,,,"강화군 문화관광 <a href=""https://www.ganghwa.go.kr/open_content/tour/trip/mt/mani.jsp"" target=""_blank"" title=""새창 : 강화군 문화관광 홈페이지로 이동"">https://www.ganghwa.go.kr/open_content/tour/</a><br>강화군 시설관리공단 <a href=""https://www.ghss.or.kr/user/facilities/tour/maniMt.do"" target=""_blank"" title=""새창 : 강화군 시설관리공단 홈페이지로 이동"">https://www.ghss.or.kr</a>",0,,,,2,1,A01,A0101,A01010400,인천광역시 강화군 화도면 마니산로675번길 18,,23060,126.4237865154,37.6324672881,6,"마니산은 강화 8경 중 한 곳으로, 마리산(摩利山), 마루산, 두악산(頭嶽山)이라고도 한다. 강화도 남서단에 위치하고 한반도의 중앙에 자리 잡고 있다. 또 해발 472.1m의 높이로 강화도에서 가장 높다. 마니산 정상에는 단군왕검이 천제를 올리던 곳으로 기록되어 있는 참성단(塹城壇) 이 자리 잡고 있는데, 기초는 하늘을 상징하여 둥글게 쌓고 단은 땅을 상징하여 네모로 쌓아 하원상방형을 이루고 있다. 지금도 개천절이면 제례를 올리고, 매년 전국체전 성화가 이곳에서 채화되어 봉송되고 있는 민족의 영산이다. 등산로를 따라 918개의 돌계단을 올라가면 서해바다 풍경이 한눈에 들어와 아름다운 경치를 만끽할 수 있다."
3061182,12,마니산국민관광지,20231128164116,20241121134102,,,"<a href=""https://www.ghss.or.kr/user/facilities/tour/maniMt.do"" target=""_blank"" title=""새창 : 홈페이지로 이동"">https://www.ghss.or.kr</a>",,http://tong.visitkorea.or.kr/cms/resource/14/3001014_image2_1.jpg,http://tong.visitkorea.or.kr/cms/resource/14/3001014_image3_1.jpg,Type3,2,1,A01,A0101,A01010400,인천광역시 강화군 화도면 마니산로675번길 18,,23060,126.4238087338,37.6325117278,6,"마니산은 마리산, 마루산, 두악산 이라고도 한다. 백두산과 한라산의 중간 지점에 있는 해발 472.1m의 높이로 강화도에서 가장 높은 산이다. 정상에는 [고려사]지리지나 [세종실록]지리지, 그 외 각종 사서나 지리지 등에 단군왕검이 천제를 올리던 곳으로 기록된 참성단이 자리 잡고 있다. 기초는 하늘을 상징하여 둥글게 쌓고 단은 땅을 상징하여 네모로 쌓아 하원 상방형을 이루고 있다. 지금도 개천절이면 제례를 올리고, 전국 체육대회의 성화가 칠선녀에 의해 채화된다. 민족의 성지로 알려진 마니산은 산세가 수려하며 기가 우리나라에서 가장 센 곳이라 하여, 전국 제1의 생기처라 불리고 있다.
등산코스는 크게 3개로 개미허리라고 불리는 918의 계단로, 단군로, 함허동천 쪽에서 올라가는 코스로 정상에 오르면 인천국제공항과 영종도, 장봉도 등 주변의 섬들이 한눈에 들어와 많은 관광객이 찾고 있다."
2782697,12,마리앤쥬,20211129200844,20250327144807,,,"<a href=""https://marienzoo.modoo.at/"" target=""_blank"" title=""새창 : 마리앤쥬 사이트로 이동"">https://marienzoo.modoo.at/</a>",0,http://tong.visitkorea.or.kr/cms/resource/40/3437040_image2_1.jpg,http://tong.visitkorea.or.kr/cms/resource/40/3437040_image3_1.jpg,Type3,2,8,A02,A0202,A02020600,인천광역시 연수구 신송로125번길 13 (송도동),302호,21995,126.6511945522,37.3946183987,6,"마리앤쥬는 여우, 미어캣, 스컹크, 페럿, 고슴도치, 토끼, 돼지, 뱀, 거북이 등 40여 종의 동물이 함께 어우러져 살아가는 공간이다. 동물과 사람 모두 편안하고 안전하게 교감할 수 있도록, 마리앤쥬만의 차별화된 공간을 만들었다. 도심에서 쉽게 접하기 어려웠던 동물들을 가까이에서 만나 교감하고 동물이 성장하는 모습을 관찰할 수 있다. 올바른 교감 방법과 동물을 배려하는 방법 안내에서부터 마리앤쥬의 교감이 시작된다. 동물과 교감하며 생명의 소중함을 배우고, 동물을 사랑하고 배려하는 방법을 자연스럽게 익히게 된다."
3074715,12,마시안갯벌체험장,20230830122628,20241107105213,,,"<a href=""http://www.masian.co.kr/"" target=""_blank"" title=""새창 : 홈페이지로 이동"">www.masian.co.kr</a>",,http://tong.visitkorea.or.kr/cms/resource/00/3074700_image2_1.jpg,http://tong.visitkorea.or.kr/cms/resource/00/3074700_image3_1.jpg,Type3,2,10,A02,A0203,A02030100,인천광역시 중구 마시란로 107-8,,22385,126.4169926755,37.4316738749,6,"영종도 마시안해변에 위치하고 있는 마시안갯벌체험장은 마시안마을 어촌계에서 관리, 운영하는 갯벌생태체험장이다. 해양 생태계가 비교적 잘 보존되어 있고 수도권에 위치한 까닭에 연간 수많은 사람들이 이곳을 찾는다. 서해안은 갯벌까지 거리가 비교적 먼 편인데, 마시안해변은 서해안에서도 보기 드물게 조금만 가도 갯벌이 나타난다. 이곳에서 주로 채취할 수 있는 어패류는 동죽, 골뱅이, 소라 등 다양하다. 체험장 입구에서 입장료를 내면 주황색 조끼를 나눠주는데 이 조끼를 겉옷 위에 입고 체험장 안으로 들어가면 된다. 별도의 조끼 보증금을 내야 하는데, 체험이 끝나고 반납하면 돌려준다. 이용요금에는 세면장 이용료가 포함돼 있다. 장화와 호미를 준비해가도 되지만 없을 경우 유료로 대여를 할 수 있다. 조개가 더 많은 먼 갯벌에 나가 체험하려면 갯벌 마차를 이용하면 된다. 경운기를 개조해 만든 갯벌 마차는 현장에서 비용을 내고 이용 가능하다. 체험 시간은 하루 한 두 차례 갯벌이 드러나는 시간에 가능한데 수시로 변동됨으로 미리 확인하고 방문해야 한다. 1인당 나눠주는 2kg의 망에 캐낸 조개를 담아갈 수 있다. 호미로 갯벌 속에서 보물찾기를 하듯 조개를 캐는 체험은 남녀노소 모두 즐길 수 있는 체험이다. 이곳에서는 갯벌 체험뿐만 아니라 맨손으로 고기를 잡는 체험인 ‘어전임통’과 학교나 단체를 위한 다양한 체험프로그램을 운영하고 있다. 주변에 마시안해변 카페거리, 거잠포해변이 있다."
2783003,12,마이랜드,20211130002328,20250317175003,,,"<a href=""http://www.my-land.kr/"" target=""_blank"" title=""새창 : 마이랜드 사이트로 이동"">http://www.my-land.kr</a>",0,,,,2,10,A02,A0202,A02020600,인천광역시 중구 월미로 252,(북성동1가),22303,126.5983832839,37.4738860361,6,"마이랜드는 월미도 하면 떠오르는 대관람차와 바이킹으로 유명한 놀이공원으로 TV 프로그램이나 유튜브에서도 여러 번 방영된 적이 있는 인천의 대표 놀이공원이다. 월미도의 명물 마이랜드 타가다 디스코는 12가지 차별화된 동작으로 타는 재미와 더불어 구경하는 재미도 동시에 느낄 수 있다.
아찔한 스케일과 스릴 있는 90도 회전의 2층 바이킹과 하늘 위에서 빙글빙글 회전하면서 점프하는 점프보트, 아이들이 좋아하는 점핑점핑 등 다양한 놀이 시설이 있다. 소지품을 맡겨 둘 수 있는 물품 보관함이 마련되어 있고, 출출함을 달랠 수 있는 먹거리 판매 상점들도 길게 들어서 있다.

◎ 한류의 매력을 만나는 여행 정보
웹 예능 <투어요정> 속 성규와 외국인 관광객들이 디스코팡팡을 즐긴 마이랜드는 월미도의 대표 테마파크다. 바다 전망과 아찔한 스릴감을 동시에 갖춘 놀이 시설을 즐긴 뒤, 가까운 월미 전망대, 송월동 동화마을에 들러 산책을 즐겨도 좋다."
3061206,12,만석동 주꾸미거리,20231128172835,20241203175154,,,"<a href=""https://itour.incheon.go.kr/ssst/ssst/detail.do?pgListMode=S&cotId=ITD21122714273339257""target=""_blank"" title=""새창: 인천관광공사 홈페이지로 이동"">https://itour.incheon.go.kr</a>",,http://tong.visitkorea.or.kr/cms/resource/33/3001333_image2_1.jpg,http://tong.visitkorea.or.kr/cms/resource/33/3001333_image3_1.jpg,Type3,2,5,A02,A0203,A02030600,인천광역시 동구 만석동,54-2,22501,126.6239890323,37.4828354471,6,만석동 주꾸미거리는 인천 원도심의 옛 추억을 그대로 간직한 곳이다. 이 골목은 만석동과 송월동을 연결하는 만석고가교 근처에 위치한다. 과거에 주변 포구에서 어부들이 잡아온 저렴한 주꾸미로 맛있는 요리를 만들어 파는 음식점들이 모여들면서 만석동 주꾸미거리가 형성되었다. 이곳에는 50년 전통의 맛집부터 소박한 식당들이 자리하고 있어 다양한 주꾸미 요리를 맛볼 수 있다. 인천 사람들뿐만 아니라 많은 여행객들이 샤부샤부처럼 약한 불에 데쳐 회고추장에 찍어먹는 주꾸미와 전골로 끓인 주꾸미 요리를 맛보기 위해 이곳을 찾고 있다. 지금은 신도시에 밀려 점차 잊혀져 가지만 사람사는 삶의 모습을 볼 수 있으며 소박하지만 정감 있는 먹자골목이다.
2768168,12,만석부두,20211104200357,20250317102334,,,"<a href=""https://www.icdonggu.go.kr/tour/sights/map.jsp#manseokpier""target=""_blank"" title=""새창: 인천동구청 문화관광 홈페이지로 이동"">https://www.icdonggu.go.kr/tour</a>",0,,,,2,5,A01,A0101,A01011400,인천광역시 동구 만석동 9-34,(만석동),22504,126.6214419320,37.4868154950,6,"서울로 향하는 곡물을 만석이나 쌓아놓았던 곳이라 해서 만석이라는 이름이 붙었다는 만석부두는 주말이면 낚시꾼들이 즐겨 찾는 명소로 유명한 곳이다.
만석부두와 화수부두는 1970년대까지 인천의 대표 어항으로 인천 유일의 수산물 공판장이자 새우젓으로 전국적 유명세를 타고 있다. 또한 ‘노을 따라 해안산책로길’ 코스 중 한 곳으로 바다를 산책하며 볼 수 있도록 조성한 만석·화수해안산책로를 노을이 질 때 걸어 보면 좋다. 다른 바다에서는 볼 수 없는 거대한 조선소와 선박을 수리하는 병원, 물치도, 십자수로, 멀리 목재공장의 목재 찌는 증기와 아름다운 노을 등이 연출하는 풍광을 천천히 즐길 수 있는 길이다."
3429335,12,만수산 무장애나눔길,20241129110322,20241226172638,,,,,http://tong.visitkorea.or.kr/cms/resource/42/3432342_image2_1.jpeg,http://tong.visitkorea.or.kr/cms/resource/42/3432342_image3_1.jpeg,Type1,2,4,A01,A0101,A01010400,인천광역시 남동구 만수로111번길 38-1 (만수동),,21521,126.7356764817,37.4679224874,6,"만수산 나눔길은 교통약자(장애인, 노약자 임산부, 영유아 ) 구민 모두가 안전하게 숲의 혜택을 누릴 수 있고, 계단이 없는 2230m의 통산로이다."
