contentid,contenttypeid,title,createdtime,modifiedtime,tel,telname,homepage,booktour,firstimage,firstimage2,cpyrhtDivCd,areacode,sigungucode,cat1,cat2,cat3,addr1,addr2,zipcode,mapx,mapy,mlevel,overview
2790984,14,장흥조각공원(양주시립장욱진미술관),20211210003831,20250320104344,,,"<a href=""https://www.yangju.go.kr/changucchin/index.do"" target=""_blank"" title=""새창 : 양주시립장욱진미술관 홈페이지로 이동"">https://www.yangju.go.kr/changucchin/</a>",0,http://tong.visitkorea.or.kr/cms/resource/67/3331967_image2_1.jpg,http://tong.visitkorea.or.kr/cms/resource/67/3331967_image3_1.jpg,Type3,31,18,A02,A0206,A02060300,경기도 양주시 장흥면 권율로 193,,11519,126.9492661845,37.7328704810,6,"양주시립장욱진미술관은 한국 근현대미술을 대표하는 장욱진의 업적과 정신을 기리며, 한국현대미술의 발전에 이바지하는 미술작품과 자료를 전시, 연구, 수집을 목적으로 한다. 양주시립장욱진미술관은 순수한 이상적 내면세계를 추구한 장욱진 화백의 정신을 기리며, 장욱진 정신과 관련된 작가 및 후대작가의 주제기획전시를 통한 한국현대미술 연구하고자 한다. 또한, 우리 미술관은 시민들이 공감할 수 있는 다양한 전시와 교육프로그램, 미술창작스튜디오 운영 등을 통해 지역사회 및 대중과 호흡하는 시립미술관으로 자리하고자 한다. 현재 양주시립장욱진미술관은 신진 및 중견작가의 창작활동을 지원하는 양주시립미술창작스튜디오를 두고 있다. 양주시립미술창작스튜디오는 회화, 사진, 복합매체 작가들을 위한 777레지던스가 운영 중이며 개인전시, 워크숍, 오픈스튜디오, 기획전 등 다양한 프로그램을 제공하고 있다."
1284966,14,전곡선사박물관,20110524201433,20240517093734,,,"전곡선사박물관 <a href=""https://jgpm.ggcf.kr/"" target=""_blank"" title=""새창 : 전곡선사박물관 홈페이지로 이동"">https://jgpm.ggcf.kr/</a>",0,http://tong.visitkorea.or.kr/cms/resource/81/2642381_image2_1.jpg,http://tong.visitkorea.or.kr/cms/resource/81/2642381_image3_1.jpg,Type3,31,21,A02,A0206,A02060100,경기도 연천군 전곡읍 평화로443번길 2,,11027,127.0637282456,38.0115706054,6,전곡선사박물관은 동아시아 최초의 아슐리안형 주먹도끼 발견으로 세계 구석기 연구의 역사를 다시 쓰게 만들었던 역사적 현장인 전곡리 구석기유적에 건립된 유적박물관이다. 전곡리 구석기유적지에서 출토된 아슐리안형 주먹도끼등의 구석기 유물들을 중심으로 인류의 진화와 구석기시대 문화를 체계적으로 이해할 수 있도록 다양한 주제의 유물들로 전시공간을 구성하였다.
2788928,14,정약용도서관,20211208185700,20250404135453,,,,0,,,,31,9,A02,A0206,A02060900,경기도 남양주시 다산중앙로82번안길 138 (다산동),,12249,127.1673719588,37.6122106760,6,"다산 신도시에 자리한 정약용도서관은 2020년에 개관했다. 다산의 철학을 고스란히 담아낸 공간으로, 단순한 도서관을 넘어 복합 문화공간으로 꾸며졌다. 어린이자료실과 멀티미디어실 외에 공연장, 베이커리 카페, 레스토랑, 공유 공방 등이 한데 어우러져 있으며 외부음식을 섭취할 수 있는 좌석도 마련돼 있다. 또한 스웨덴 스톡홀름 중앙도서관에서 영감을 얻었다는 건축 설계는 실용적이면서도 감각적이다. 넓은 공간을 유기적으로 연결한 개방감, 자연 채광을 적극적으로 활용한 점 등이 기존 도서관과는 차별화된 면모를 보여준다. 1층에 마련된 어린이자료실에선 아이들이 좋아하는 주제의 전시도 열린다. 아이와 함께 책을 읽으며 쉴 수 있는 최고의 공간이다."
3304086,14,정조테마공연장,20240529163607,20240529163626,,,"<a href=""https://www.swcf.or.kr/?p=350"" target=""_blank"" title=""새창 : 정조테마공연장 홈페이지로 이동"">https://www.swcf.or.kr/?p=350</a>",,http://tong.visitkorea.or.kr/cms/resource/74/3304074_image2_1.jpg,http://tong.visitkorea.or.kr/cms/resource/74/3304074_image3_1.jpg,Type3,31,13,A02,A0206,A02060600,경기도 수원시 팔달구 정조로 817 (팔달로1가),,16261,127.0163422775,37.2811074845,6,"수원 화성행궁 광장 옆에 위치한 한옥형 실내 공연장이다. 공연장은 지하1층에 위치하며, 객석은 총 258석, 휠체어 5석으로, 수원시립공연단과 지역 예술인 공연, 전통과 현대를 어우르는 다양한 공연을 제공한다. 야외마당에서는 버스킹 공연과 상설 체험인 마당 놀이터를 운영하고, 명절이나 어린이날 등 특별한 날에도 다양항 체험 프로그램은 진행한다. 화성행궁으로 가족 나들이 및 단체 관광하면서 공연 관람하기 매우 좋다."
130714,14,조각가 박시동 미술관,20060103090000,20250320092728,,,"<a href=""http://www.sj-gallery.com"" target=""_blank"" title=""새창 : 박시동미술관 홈페이지로 이동"">www.sj-gallery.com</a>",0,http://tong.visitkorea.or.kr/cms/resource/65/3382265_image2_1.JPG,http://tong.visitkorea.or.kr/cms/resource/65/3382265_image3_1.JPG,Type3,31,21,A02,A0206,A02060500,경기도 연천군 백학면 백왕로225번길 240,,11048,126.9176070834,38.0539491147,6,"박시동미술관은 1990년 경기도 연천군 백학면 석장리, ‘작은 버드골’이라 불리던 깊은 벽촌에 집터를 닦고, 작가들이 스스로 가꾸고 다듬으며 정성껏 키워온  문화공간이다. 또한 자연의 공간이며, 자연이 되는 공간, 자연과 하나 되는 공간이기도 하다. 1999년 첫 번째 민통선 예술제를 시작으로 미술관을 개관하여 학생들의 문화체험 공간 및 가족단위 휴식공간으로 활용되고 있다. 조각공원과 카페, 펜션 등도 함께 운영하며, 해마다 민통선 예술제가 펼쳐진다."
130742,14,조명박물관,20060227090000,20240516144454,,,"조명박물관 <a href=""http://www.lighting-museum.com/"" target=""_blank"" title=""새창 : 조명박물관 홈페이지로 이동"">http://www.lighting-museum.com</a>",0,,,,31,18,A02,A0206,A02060100,경기도 양주시 광적면 광적로 235-48,,11414,126.9674976777,37.8360726730,6,"조명박물관은 2004년에 설립, 2005년 등록(제05-박-05호)한 대한민국 유일의 조명 전문 박물관으로 다음과 같은 설립 목표를 갖고 있다.<br>
<br>
* 사라진 고유한 조명문화를 복원하고 재생시킨다.<br>
* 빛의 과거, 현재, 미래를 제시하여 인류 조명문화를 재발견한다.<br>
* 미래지향적인 융복합 조명문화를 창조한다.<br>
* 자연과 인간이 공존하고 발전하는 건강한 빛의 문화를 정립한다."
130565,14,조병화문학관,20060629090000,20240613142301,,,"▪ <a href=""http://www.poetcho.com/"" target=""_blank"" title=""새창 : 홈페이지로 이동"">http://www.poetcho.com</a>",0,,,,31,16,A02,A0206,A02060200,경기도 안성시 양성면 난실길 14-1,,17501,127.2215950764,37.1120668213,6,"조병화문학관은 편운 조병화 시인의 유품 및 창작 저작물, 그림을 상설 전시하는 문학기념관으로 난실리 편운 동산 안에 예쁜 전원주택처럼 자리 잡고 있다.
조 시인이 전 생애의 창작활동을 통해 추구해 온 꿈과 사랑의 시정신이 오롯이 담겨 있으며, 한국 현대문학의 한 발자취가 보존된 곳이다. 조병화문학관은 1993년 조 시인이 대지를 제공하고 국고의 지원을 받아 문화사랑방으로 지어진 연건평 85평 규모의 2층 건물이며 8평의 부속 건물을 두고 있다. 1층에 전시실 2실, 2층에 세미나실을 갖추고 있다. 문학관에는 기획전시물과 조병화 시인이 남긴 53권의 창작시집, 수필집, 화집 등 160여 권의 서적, 시인의 유물 등이 있다.
편운 동산에는 문학관 외에도 넓은 잔디밭을 중심으로 1963년 시인이 어머니 묘소 옆에 세운 묘막인 편운재와, 교직 은퇴 후 시인이 집필 또는 휴식을 취하던 시골집인 청와헌, 또 조병화 시인의 묘소가 있다.
쉽게 읽히면서도 또한 깊은 감동을 전하는 시인의 시와 어울리게, 이 편운 동산에서 은은하고 그윽한 풍경을 느낄 수 있다. 또한 매년 5월 문학관에서 꿈과 사랑의 시 축제를 개최해 많은 사람에게 문학의 울림을 전달하는 좋은 기회를 제공하고 있다."
2754294,14,조소앙기념관,20211007011012,20250328134705,,,"<a href=""http://www.chosoang.kr/"" target=""_blank"" title=""새창 : 조소앙선생기념관사이트로 이동"">http://www.chosoang.kr/</a>",0,http://tong.visitkorea.or.kr/cms/resource/55/3406855_image2_1.jpg,http://tong.visitkorea.or.kr/cms/resource/55/3406855_image3_1.jpg,Type3,31,18,A02,A0206,A02060200,경기도 양주시 남면 양연로173번길 87,,11402,126.9947010577,37.9217353956,6,"독립운동가 조소앙 선생의 고귀한 생애를 확인할 수 있는 공간이며, 조국의 자주독립과 민주발전을 위해 희생한 선생의 독립정신과 민족정신을 되새길 수 있는 특별한 공간이다. 기념관 내부에는 조소앙 선생의 생애, 사상, 그리고 그가 기여한 독립운동의 역사적 배경을 설명하는 다양한 자료와 전시물이 마련되어 있다. 또한 기념관 주변은 아름다운 정원으로 조성되어 있어 방문객들이 자연 속에서 편안한 시간을 보낼 수 있다."
2684972,14,종이미술관,20201124003344,20250319095030,,,"<a href=""http://www.xn--zb0bw7zdte34f8nb.com/"" target=""_blank"" title=""새창: 종이미술관 홈페이지로 이동"">http://종이미술관.com </a>",0,,,,31,15,A02,A0206,A02060500,경기도 안산시 단원구 대남로 233,,15649,126.5760005234,37.2245645862,6,"종이 미술관은 한국 최초의 종이조형 미술관으로 종이와 미술을 소재로 다양하게 표현되는 문화와 예술을 통해 이웃과 함께하는 행복하고 아름다운 미술관이다. 어린이 미술관, 전통놀이 체험장, 한옥체험장, 공예품 만들기 체험장을 갖추고 있으며 야외 잔디공원에서 뛰어놀 수 있고 한옥에서 숙박도 할 수 있는 힐링공간이다."
3023343,14,주니어천문스쿨 수지점,20231024103457,20241114142825,,,"<a href=""http://justar.co.kr"" target=""_blank"" title=""새창 : 홈페이지로 이동"">http://justar.co.kr</a>",,http://tong.visitkorea.or.kr/cms/resource/23/3023323_image2_1.jpg,http://tong.visitkorea.or.kr/cms/resource/23/3023323_image3_1.jpg,Type3,31,23,A02,A0206,A02060300,경기도 용인시 수지구 성복2로301번길 7 (성복동),2층,16805,127.0551599358,37.3182538749,6,"주니어천문스쿨 수지점은 도심에서 밤하늘을 관측할 수 있는 천문대이다. 초등학생과 중학생을 대상으로 우주과학 지식을 나누고 천문학에 대한 이해와 견문을 넓힐 수 있도록 하는 민간교육기관으로 2018년 개소했다. 2014년 천안을 시작으로 동탄, 세종, 수지, 대구에 어린이천문대를 운영하고 있는 주니어천문스쿨의 수지지점이다.
[어린이는 별을 보며 무한한 상상력을 키워야합니다]라는 슬로건 아래, 3개의 정규교실과 특별과정, 4개의 1회성 일일체험교실을 운영한다. 정규교실은 팀수업으로 각 단계마다 수준별 체계적인 전문교육이 이루어진다. 초등학생 어린이 대상 프로그램을 주 사업으로 하며 유치원∙초∙중∙고 단체 맞춤형 프로그램을 운영하고 있고 가족단위로도 신청할 수 있다. 옥상에 천체관측을 위한 4m 원형돔, Celestron 14인치 반사굴절망원경 등 다양한 관측장비를 갖추고 있다.
신분당선 성복역에서 차량으로 약 6분 소요된다. 인근에 한국민속촌, 다이노베이, 에버랜드, 광교산, 청계산, 율동공원 등이 있다."
1753572,14,죽전야외음악당,20121117013705,20240607144614,,,"<a href=""http://yicf.or.kr/"" target=""_blank"" title=""새창 : 용인문화재단 홈페이지로 이동"">http://yicf.or.kr</a>",0,http://tong.visitkorea.or.kr/cms/resource/09/3068609_image2_1.jpg,http://tong.visitkorea.or.kr/cms/resource/09/3068609_image3_1.jpg,Type3,31,23,A02,A0206,A02060600,경기도 용인시 수지구 죽전로168번길 9,(죽전동),16889,127.1264643720,37.3254432096,6,"단국대학교 죽전캠퍼스 부근에 위치한 죽전야외음악당은 용인 시민의 여가와 문화생활 증진을 위해 2005년 11월 개관하였다. 2011년 출범한 용인문화재단이 운영하고 있다. 
지상 4층, 지하 1층 규모로 건립된 죽전야외음악당은 공연장과 연습실의 시설을 갖추고 있다. 반원형 천장과 이와 연결된 금속 구조물 아래쪽에 158㎡ 규모의 무대와 680석의 층계식 객석을 배치하였고 뒤에 펼쳐진 잔디 객석은 자연스럽게 작은 숲속으로 연결되어 있어 야간 공연 시 인공조명과 자연의 숲이 어우러져 공연의 분위기를 고조시켜 준다. 죽전 주거단지 내 숲속에 자리하고 있어 자연 친화적인 문화공간으로의 특징을 갖고 있는 죽전야외음악당에서는 시민들이 참여하는 각종 문화행사 및 영화 상영, 공연, 연주회 등이 수시로 개최된다.
판교IC에서 약 17분, 수인분당선 죽전역에서 차량으로 약 4분 소요된다. 인근에 에버랜드, 한국민속촌, 한국잡월드, 세계문화유산 융건릉, 물향기수목원, 용인농촌테마파크, 덕평공룡수목원 등이 있다."
2553922,14,죽포미술관,20180717192427,20240522163228,,,"죽포미술관 <a title=""새창 : 죽포미술관 홈페이지로 이동"" href=""http://www.jpmuseum.co.kr"" target=""_blank"">http://www.jpmuseum.co.kr</a>",0,http://tong.visitkorea.or.kr/cms/resource/47/3067847_image2_1.jpg,http://tong.visitkorea.or.kr/cms/resource/47/3067847_image3_1.jpg,Type3,31,20,A02,A0206,A02060500,경기도 여주시 산북면 고촌길 26-10,,12600,127.4426221849,37.4100224676,6,"루덴시아 부근에 있는 죽포미술관은 작품소장과 보전 및 미술 문화 교류를 목적으로 하는 미술관이다. 국내에서 보기 드문 중국미술을 볼 수 있어 미술 애호가들이 즐겨 찾는 곳이다.
의사였던 설립자 조윤석 관장이 컬렉션으로 시작해 그림을 배우다가 미술관을 지어 무료 개방하는 곳으로 미술전시실과 야외 조각공원으로 이루어져 있다. 미술관은 40여 년 수집한 중국의 도자기 200여 점, 중국 수묵채색화 400점, 유화 100여 점, 중국년화 400점, 중국전지 1,000점, 만다라 10점, 탱화 10점, 테페스트리 10점 등의 미술품과 개인 작품들을 상설 전시하고 있다. 이곳에서는 개인 미술품 및 한국, 중국의 도자기를 비교하며 볼 수 있고, 한국∙중국회화의 학술 교류 및 초대전, 학술대회 등을 개최하고 있다. 동절기 1, 2월에는 휴관하므로 방문 전 확인이 필요하다.
동곤지암IC에서 차량으로 약 8분 소요된다. 인근에 루덴시아, 곤지암리조트스키장, 사기막골도예촌, 설봉공원, 영녕릉[세종대왕 영릉/효종대왕 영릉], 명성황후 생가, 파사성, 여주박물관, 목아박물관, 황포돛배 등이 있다."
129897,14,중남미문화원,20071106103444,20240717212522,,,"<a href=""http://www.latina.or.kr/"" target=""_blank"" title=""새창 : 중남미문화원 홈페이지로 이동"">http://www.latina.or.kr</a><br><a href=""https://www.instagram.com/latinamuseum/""target=""_blank"" title=""새창 : 공식인스타그램로 이동"">https://www.instagram.com/latinamuseum</a>",0,,,,31,2,A02,A0206,A02060800,경기도 고양시 덕양구 대양로285번길 33-15,,10273,126.8953524855,37.7040673115,6,"중남미문화원은 중남미 지역의 문화와 예술에 대한 이해를 돕고, 청소년들의 꿈과 이상과 건전한 세계관의 확립에 도움이 되기 위한 취지로 1994년 건립되었다. 현재 개인 및 단체는 물론 학회, 외교단, 기업과 교육 기관 등에서 많이 이용하고 있으며 2018년 한국관광공사 ‘KOREA 유니크 베뉴’ 20개 장소 중 하나로 선정되었다. 박물관은 중남미의 대표적 문화인 마야, 아즈텍, 잉카, 식민기 시대의 유물이 전시되어 있으며 미술관은 중남미 대표 작가들의 그림과 조각, 전통의상과 직물이 전시되어 있다.
또한 조각 공원에는 중남미 12개국의 현대 작가들의 작품이 공원 및 산책로, 휴식공간 곳곳에 자리 잡고 있어 라틴아메리카 문화의 정취를 느낄 수 있다.
2011년 개관된 종교전시관과 벽화는 중남미 종교 회화와 조각, 스테인드글라스, 아름다운 제단을 감상할 수 있으며 가로 24m, 세로 5m의 장대한 도자 벽화는 중남미 원주민들의 전통과 정신을 소중히 여기는 인디헤니스모 사상을 감상할 수 있다."
129844,14,중앙대학교박물관,20041223090000,20250315121827,,,"<a href=""https://alibrary.cau.ac.kr/#/guide/info/structure6"" target=""_blank"" title=""새창 : 홈페이지로 이동"">https://alibrary.cau.ac.kr</a>",0,http://tong.visitkorea.or.kr/cms/resource/53/3475953_image2_1.JPG,http://tong.visitkorea.or.kr/cms/resource/53/3475953_image3_1.JPG,Type3,31,16,A02,A0206,A02060100,경기도 안성시 대덕면 서동대로 4726,,17546,127.2301750634,37.0051043220,6,"중앙대학교 박물관은 중앙대 안성캠퍼스인 다빈치 캠퍼스의 중앙도서관에 위치해 있다. 중앙도서관 내의 학술정보원 1층에 소재하고 있으며, 총 274.42평에 고고, 역사, 미술, 민속유물과 관련된 유물을 소장 및 전시하고 있다. 토도류가 296점으로 가장 많고 그 외에 목족류, 금속류, 피혁류, 인쇄 유물, 서화류, 옥석류, 의상류 및 기타 37점 등 1,089점의 유물을 소장하고 있으며, 구역을 나누어 전시하고 있다. 
개관하는 날이 많지 않아 관람 시 전화 문의를 해보는 게 좋으며 학생 등의 단체관람 시 성인 인솔자 필수이다. 개관일 외 단체관람을 원할 경우 사전예약이 반드시 필요하다. 또한 관람 시 신분증을 반드시 소지해야 한다."
790195,14,지앤아트스페이스,20090901014146,20240826170559,,,"지앤아트스페이스 <a href=""http://www.zienart.com"" target=""_blank"" title=""새창 : 지앤아트스페이스 홈페이지로 이동"">http://www.zienart.com</a>",0,http://tong.visitkorea.or.kr/cms/resource/69/2364469_image2_1.jpg,http://tong.visitkorea.or.kr/cms/resource/69/2364469_image3_1.jpg,Type3,31,23,A02,A0206,A02060500,경기도 용인시 기흥구 백남준로 7,(상갈동),17068,127.1101229723,37.2698993483,6,"백남준아트센터 맞은편에 있는 지앤아트스페이스는 갤러리와 지앤숍, 도예공방, 화원, 레스토랑, 카페가 있는 복합 공간이다. 도자공예가 지종진이 설립하고 건축가 조성룡이 설계한 곳으로 2009년 개관하였다. 지앤[ZIEN]이라는 이름은 흙, 땅, 대지를 뜻하는 한자어 지[地]와 열린 가능성을 이르는 앤드[and]를 합성한 것으로 흙으로부터 무한히 퍼져 나오는 삶과 예술의 새로운 가능성이라는 의미를 담고 있다.
지하 1층과 지상 2층 규모로 건축된 지앤아트스페이스는 백남준아트센터와 자연스럽게 연결되며 다섯 개의 개별 건물이 하나의 건물처럼 이어지도록 구성하여 2009년 준공 부문 한국건축문화대상을 수상하기도 하였다. 지앤아트스페이스는 상설전 및 특별전을 개최하는 전시 공간과 갤러리와 작가들의 창작 공간으로 레지던스 프로그램을 지원하는 스튜디오, 어린이들의 도예교육과 전시를 통해 어린이 작가를 발굴하는 키즈 스튜디오가 있다. 또한, 핸드페인팅, 빚어만들기, 물레체험 등의 원데이클래스를 진행하는 아카데미와 리빙제품과 토분을 전시하고 판매하는 지앤숍, 이탈리안 레스토랑과 카페, 기업 및 단체 워크숍 및 학술 세미나 등의 행사를 열 수 있는 이벤트홀로 구성되어 있다. 
싱그러운 식물과 토분으로 둘러싸인 곳에서 차나 식사를 즐기고, 전시와 도예체험으로 다양한 문화생활을 누릴 수 있어 연인 및 친구, 가족과 함께 나들이하기 좋은 곳이다.
수원신갈IC에서 차량으로 약 5분, 수인분당선 상갈역에서 약 4분 소요되며 역에서 한 번에 가는 버스가 있다. 인근에 경기도박물관, 경기도어린이박물관, 한국민속촌, 기흥호수공원, 덕평공룡수목원, 별빛정원우주, 한택식물원 등이 있다."
2022937,14,지영희국악관,20150807223256,20250327093805,,,"<a href=""https://ptgugakcenter.modoo.at"" target=""_blank"" title=""새창 : 지영희국악관 홈페이지로 이동"">https://ptgugakcenter.modoo.at</a>",0,http://tong.visitkorea.or.kr/cms/resource/42/3350142_image2_1.jpg,http://tong.visitkorea.or.kr/cms/resource/42/3350142_image3_1.jpg,Type3,31,28,A02,A0206,A02060300,경기도 평택시 현덕면 평택호길 147,,17972,126.9214497062,36.9215723613,6,"평택이 낳은 근대 국악의 아버지 지영희를 소개하는 전시관으로 국악의 대중화, 현대화, 세계화를 이끌었던 그의 업적을 볼 수 있는 곳이다. 국가무형문화재 제52호 시나위 예능보유자였던 그의 예술세계를 조명하고 공연도 열리는 종합예술의 장이다. 국악계에 있어 매우 가치가 크고 희귀한 다량의 유물이 전시되어 있으며, 전시실은 지영희의 일생, 업적, 말년, 풍류무대로 구성되어 있다. 이외에도 웃다리평택농악, 평택민요 등 평택 전통예술도 함께 알 수 있도록 음악과 영상을 감상하는 코너도 마련되어 있다. 전시관 관람을 통해 평택이 진정한 한국 소리의 본 고장임을 느껴볼 수 있다."
130825,14,지혜샘어린이도서관,20060509090000,20241113182433,,,"<a href="" http://www.suwonlib.go.kr/jkid"" target=""_blank"" title=""새창 : 지혜샘어린이도서관 홈페이지로 이동""> http://www.suwonlib.go.kr/jkid</a>",0,,,,31,13,A02,A0206,A02060900,경기도 수원시 권선구 동탄원천로 818 지혜샘도서관,,16683,127.0399243928,37.2481339456,6,"수원시에는 일반적인 도서관 외에 어린이만을 위한 전용 도서관인 슬기샘, 바른샘, 지혜샘 도서관이 있다. 지혜샘어린이도서관은 2005년 개관 미래 꿈나무라고 할 수 있는 어린이들이 슬기롭고 지혜로우며 바른 어린이로 자랄 수 있도록 설립된 지식정보 및 문화공간이다.
이곳은 총 3개 층으로 이루어져 있으며, 1층은 유아 자료실인 옹달샘, 2층은 초등 자료실인 두레샘, 3층은 가족 자료실과 강당, 환경에너지관이 있다. 약 14만여 권에 달하는 장서와 함께 다양한 독서문화 프로그램을 진행하여 자라나는 새싹들에게 꿈과 희망, 호기심을 갖도록 하며 다가오는 지식정보화시대에 문화 체험 및 정보마인드를 향상시키고자 한다."
2609320,14,지혜의 숲,20190704012559,20241122103022,,,"지혜의 숲 <a href=""http://www.forestofwisdom.or.kr/#firstPage"" target=""_blank"" title=""새창: 지혜의 숲 "">http://www.forestofwisdom.or.kr</a>",0,http://tong.visitkorea.or.kr/cms/resource/23/3039023_image2_1.jpg,http://tong.visitkorea.or.kr/cms/resource/23/3039023_image3_1.jpg,Type3,31,27,A02,A0206,A02060900,경기도 파주시 회동길 145,(문발동),10881,126.6867408704,37.7087269330,6,"아시아출판문화 정보 센터에 위치하고 있는 지혜의 숲은 가치 있는 책을 한데 모아 보존·보호하고 관리하며 함께 보는 공동의 서재이다.
지혜의 숲은 출판도시문화 재단이 2014년도에 문화체육관광부의 후원을 받아 조성한 이래 재단의 자체 재원으로 운영하고 있는 복합문화공간이다.
<출처: 지혜의 숲>

◎ 한류의 매력을 만나는 여행 정보
소녀시대 데뷔곡 ‘다시 만난 세계’의 뮤직비디오 촬영지다. 효연의 댄스 브레이크 장면이 바로 이곳 야외 계단에서 촬영됐다. 건축상을 수상한 이색적인 건물 풍경은 <로맨스는 별책부록>, <부부의 세계> 등 여러 드라마의 배경이 되기도 했다."
