contentid,contenttypeid,title,createdtime,modifiedtime,tel,telname,homepage,booktour,firstimage,firstimage2,cpyrhtDivCd,areacode,sigungucode,cat1,cat2,cat3,addr1,addr2,zipcode,mapx,mapy,mlevel,overview
2737295,14,매향리평화역사관,20210830191101,20250322162916,,,"<a href=""https://www.ggtour.or.kr/travel-info/tourism-info/72611e7a-746a-11ee-b910-0242ac120002"" target=""_blank"" title=""새창 : 홈페이지로 이동"">https://www.ggtour.or.kr/main</a>",0,http://tong.visitkorea.or.kr/cms/resource/14/3350214_image2_1.jpg,http://tong.visitkorea.or.kr/cms/resource/14/3350214_image3_1.jpg,Type3,31,31,A02,A0206,A02060200,경기도 화성시 우정읍 기아자동차로 199,,18570,126.7634883258,37.0479994245,6,"매향리평화역사관은 경기도 화성시 우정읍에 위치한 역사적인 박물관이다. 이곳은 한국전쟁 당시 매향리에서 발생한 사건과 그로 인한 주민들의 경험을 기록하고 있는 중요한 공간이다. 매향리평화역사관은 1950년대 초, 미군의 폭격 훈련장으로 사용되던 매향리 지역에서 발생한 폭격과 그로 인한 피해를 중심으로 전시된다. 역사관은 당시의 사진, 유물, 영상 자료 등을 통해 전쟁의 상황과 그로 인한 영향을 생생하게 보여준다. 또한, 매향리 주민들의 이야기를 담아 전쟁의 역사를 기억하고, 평화와 인권의 중요성을 강조하는 교육적 공간으로 활용된다. 이곳은 전쟁의 역사를 되새기며, 평화의 가치를 널리 알리는 중요한 역할을 한다. 매향리평화역사관은 방문객들에게 과거의 이야기를 기억하게 하고, 평화로운 미래를 위한 메시지를 전하는 의미 있는 장소이다."
3079808,14,메디테리움,20240110121228,20240110121256,,,"<a href=""http://www.mediterium.co.kr/"" target=""_blank"" title=""새창 : 홈페이지로 이동"">http://www.mediterium.co.kr/</a>",,http://tong.visitkorea.or.kr/cms/resource/02/3079802_image2_1.jpg,http://tong.visitkorea.or.kr/cms/resource/02/3079802_image3_1.jpg,Type3,31,27,A02,A0206,A02060100,경기도 파주시 회동길 338 (서패동),1층,10881,126.6919290902,37.7156512184,6,"메디테리움은 파주 출판도시 인근에 위치한 의학 테마 문화공간으로 의학 서적 전문 출판사인 군자출판사에서 운영하고 있다.
이곳은 우리가 일생동안 떼려야 뗄 수 없는 의학에 대한 기초지식을 습득하고 두려움을 해소하는 것을 목적으로 한다. 이를 위해 의학 전문 서적을 접할 수 있는 카페 겸 서점, 의학역사박물관, 의사놀이 등의 메디컬 체험이 가능한 메디컬 체험센터 등을 갖추고 있어 의학에 대한 독서, 학습, 체험을 두루 할 수 있다. 특히 의학역사박물관에는 옛날에 쓰이던 의료 도구와 표본 등이 전시되어 있고, 메디컬 체험센터에서는 긴급 상황에서 꼭 필요한 심폐소생술도 배울 수 있다.
주변에는 오두산 통일전망대, 헤이리 예술마을 등의 관광지가 있고 운정신도시, 자유로 등이 인접하여 접근성이 좋은 편이다."
130327,14,명성황후 기념관,20071106105236,20241120141216,,,"<a href=""https://www.yjcf.or.kr/cms/content/view/291""새창 : 명성황후기념관 홈페이지로 이동"">https://www.yjcf.or.kr/cms/</a>",0,http://tong.visitkorea.or.kr/cms/resource/00/2591000_image2_1.jpg,http://tong.visitkorea.or.kr/cms/resource/00/2591000_image2_1.jpg,Type3,31,20,A02,A0206,A02060200,경기도 여주시 명성로 71,(능현동),12653,127.6540184735,37.2598881438,6,"명성황후 기념관은 명성황후생가유적지내에 위치한 공립박물관이다. 여주에서 태어나고 자란 조선 제26대 왕 고종의 비(妃)인 명성황후를 기념하기 위해 2017년 여주시가 설립하였다. 명성황후 기념관은 명성황후가 태어나 8살까지 어린 시절을 보낸 생가의 맞은편에 1층 건물로 건립되어 있으며, 기념관을 정면으로 바라보고 명성황후 순국 숭모비(좌)와 명성황후 추모비(우)가 위치하고 있다. 전시실은 면적 520㎡로 고종황제와 명성황후의 진영과 연표를 시작으로 고종, 명성황후뿐 아니라 같은 시기에 활약하였던 여흥 민씨들의 유물 및 관련 자료들을 전시한다. 명성황후의 친필과 왕비 어보, 을미사변 때 일본인이 사용했던 일본도(복제품), 생애를 재현한 디오라마 등 당시 시대 상황을 알 수 있는 각종 자료가 전시되어 있다.

기념관 주변에는 명성황후 생가뿐 아니라 숙종의 비(妃)인 인현왕후의 집이자, 명성황후가 8살에 한양으로 올라간 후 고종의 왕비로 책봉되기 전까지 머물렀던 감고당(이전 복원), 161석 규모의 공연장인 문예관, 명성황후탄강구리비, 민유중의 묘와 신도비, 연못이 있는 조각공원, 주막과 한복체험 및 전통 소품을 살 수 있는 상점 등이 있어 마치 자그마한 민속촌을 연상케 한다. 명성황후 생가유적지는 무장애 편의시설이 잘 마련되어 있어 주차장에서 기념관까지 휠체어나 유모차 이용에 불편함이 없으며, 사전예약 시 문화관광 해설도 가능하다. 여주 IC에서 차량으로 약 10분 이내의 거리에 위치하고 있다. 인근에 신륵사, 영녕릉(세종대왕 영릉/효종대왕 영릉), 파사성, 목아박물관, 여주곤충박물관, 황포돛배 등이 있다."
130928,14,명지대학교 박물관,20070716090000,20240617135043,,,"명지대학교 박물관 <a href=""http://jw4.mju.ac.kr/user/museum/"" target=""_blank"" title=""새창 : 명지대학교 박물관 홈페이지로 이동"">http://jw4.mju.ac.kr/user/museum/</a>",0,http://tong.visitkorea.or.kr/cms/resource/46/3068646_image2_1.jpg,http://tong.visitkorea.or.kr/cms/resource/46/3068646_image3_1.jpg,Type3,31,23,A02,A0206,A02060100,경기도 용인시 처인구 명지로 116,,,127.1856397023,37.2217035027,6,"명지대학교 용인캠퍼스에 있는 명지대학교 박물관은 우리나라 고고∙역사∙미술∙민속에 관한 자료들을 수집하고 전시∙보관하는 종합박물관이다.
명지대학교 박물관은 1968년부터 교육용으로 유물을 수집하던 것이 모태가 되어 1979년 3월 박물관은 크게 고고 미술실과 민속실으로 나뉘어 있으며, 명지학원의 설립자인 명진 유상근(1922~1992)의 소장품 및 유품을 비롯하여 석기, 도자기, 서화류, 민속자료 등 약 5,000여  점의 유물을 소장하고 있다. 대표적인 유물로는 한반도 중서부 도서지역의 신석기시대 유물과 용인지역 도자유물이 있으며, 이밖에 초조본 유가사지론 권17(국보), 법집별행록절요병입사기(보물), 신간표제공자가어구해(보물) 등이 있다.
박물관은 대중에게 큐레이터 추천 이달의 유물을 선정해 소개하고, 문화유산 답사와 전시 연계 교육 및 체험 프로그램을 진행하고 있다. 특히 도자 공예 체험은 누구나 참여할 수 있다.  
서용인 IC에서 차량으로 약 6분, 에버라인 명지대역에서 약 5분 소요된다. 인근에 경기도박물관, 경기도어린이박물관, 한국민속촌, 한국등잔박물관, 포은정몽주선생묘, 마가미술관, 별빛정원우주, 한택식물원 등이 있다."
1200255,14,명지산생태전시관,20110210021158,20241202135309,,,,0,,,,31,1,A02,A0206,A02060300,경기도 가평군 북면 가화로 2089-42,,12401,127.4877027984,37.9360260805,6,"가평군은 수많은 개발로 인해 환경이 파괴되어 가고 생활의 편리함만을 추구함으로 인해 오염되어 가는 자연환경을 지키고 보전하기 위해 [청정가평 지속 가능 발전협의회]를 만들어 다양한 환경 보존 프로그램을 진행하고 있다. 그 일환으로 경기도 가평군 북면 명지산 도립공원 내에 명지산 생태전시관을 건립하였다. 이곳에서는 천연 염색, 화분 만들기, 야생화 숲해설, 민물고기 체험, 자연놀이(책갈피, 나뭇잎으로 부엉이 만들기 등), 곤충표본제작하기, 농사체험 등의 다양한 자연환경체험 프로그램을 운영하고 있다. 

자연을 직접 접하고 느끼는 체험함으로써 친환경적인 생활방식을 유도하고 체계적이고 지속적인 환경 교육을 실시하기 위함이다. 주요 시설로는 야생화 관찰공간, 수변 식생 관찰원, 야외학습장, 생태전시관, 체험실 등이 있다. 터치스크린, 3D 입체 영상관 등이 있어 아이들이 흥미를 가지고 살펴볼 수 있을 뿐만 아니라, 자연해설 프로그램을 통하여 자연의 아름다움을 발견하고 자연과 어우러진 삶의 의미를 찾도록 도와주고 있다."
2377785,14,명필름아트센터,20160413004257,20250113174959,,,"<a href=""http://mf-art.kr/"" target=""_blank"" title=""새창 : 명필름아트센터 홈페이지로 이동"">http://mf-art.kr/</a>",0,http://tong.visitkorea.or.kr/cms/resource/79/3467479_image2_1.JPG,http://tong.visitkorea.or.kr/cms/resource/79/3467479_image3_1.JPG,Type3,31,27,A02,A0206,A02060600,경기도 파주시 회동길 530-20,,10881,126.6933704071,37.7233670117,6,"명필름아트센터는 29년간 51편의 영화를 제작한 명필름의 영화정신을 기반으로  대한민국 건축계를 대표하는 승효상 건축가가 설계했다. 문화콘텐츠의 발전, 공유, 확장을 목표로 파주출판도시 속의 ‘영화마을’을 꿈꾸며 주류와 인디가 공존하고 실험과 융합이 진행되는 곳이다.
4K 영사시스템과 돌비 애트모스 사운드를 장착한 국내 최고의 레퍼런스급 영화관, 커피와 음료, 샌드위치와 디저트까지 즐길 수 있는 카페&펍, 작품을 감상하고 구매할 수 있는 쇼룸, 다양한 문화행사가 열리는 공연장, 명필름 영화들이 지나온 시간의 기록을 확인할 수 있는 공간인 아카이브 룸, 누군가와 함께 작은 상영의 시간을 나누고자 하는 사람들에게 열려있는 공간인 스크리닝 룸이 5개 층에 걸쳐 있어 다양한 문화경험을 누릴 수 있는 복합문화공간이다."
129770,14,모란미술관,20071106102918,20240823160607,,,"모란미술관 <a href=""http://www.moranmuseum.org/"" target=""_blank"" title=""새창 : 모란미술관 홈페이지로 이동"">http://www.moranmuseum.org</a>",0,http://tong.visitkorea.or.kr/cms/resource/21/1589421_image2_1.jpg,http://tong.visitkorea.or.kr/cms/resource/21/1589421_image3_1.jpg,Type3,31,9,A02,A0206,A02060500,경기도 남양주시 화도읍 경춘로2110번길 8,,12190,127.3237482921,37.6504063015,6,"모란미술관은 경기도 마석에 위치한 사립미술관으로 1990년 4월에 개관하였다. 조각 전문미술관으로 출발한 모란미술관은 다양한 기획전을 개최해 왔으며 현재는 조각뿐 아니라 여러 장르의 미술을 소개, 전시하고 있다. 모란미술관의 야외조각 전시장은 8,600여 평에 이르는 공간으로 국내외 유명 조각가들의 작품이 전시되어 있으며 다양한 문화 행사가 개최되고 있다. 모란미술관 본관은 전시가 열리는 공간으로 2층 건물에 6개의 전시실을 갖추고 있다. 건축가 이영범이 설계한 수장고와 모란탑은 미국 건축가협회 뉴욕시지부에서 디자인상을 받은 건축물로 미술관의 소장품과 자료를 보관하는 곳이자 조형물이라 할 수 있다. 모란탑 안에는 루브르 미술관의 주물 아틀리에에서 로댕의 원작을 바탕으로 석고 주조한 오귀스트 로댕(Auguste Rodin, 1840-1917)의 [발자크 Balzac] 조각상이 있다. 
모란스페이스(별관)는 문화행사 및 다양한 전시가 가능한 공간으로 대관이 가능하며 모란미술관 학교 및 교육프로그램이 진행되는 곳이다. 모란 미술관에서는 전문 해설사의 전시해설을 들을 수 있으며 신청을 원할 경우 홈페이지를 통해 접수하면 된다. 이밖에 전시 연계 프로그램과 특별 교육 프로그램 그리고 다양한 문화 행사에 참여를 원할 경우에도 홈페이지를 통해 상세한 내용을 확인하고 신청할 수 있다. 대관은 실내 공간뿐 아니라 야외 공간도 가능하며 야외공간(B 구역)은 결혼식 행사를 위한 장소로, 다른 공간 역시 공연, 음악회, 드라마와 영화 촬영 등을 위한 장소로도 대관하고 있다."
129797,14,목아박물관,20071106103045,20240827164902,,,"<a href=""http://www.moka.or.kr"" target=""_blank"" title=""새창 : 목아박물관 홈페이지로 이동"">http://www.moka.or.kr</a>",0,,,,31,20,A02,A0206,A02060100,경기도 여주시 강천면 이문안길 21,,12615,127.6878701573,37.2882049380,6,"목아박물관은 한국의 전통 목공예와 불교미술의 계승 발전을 위해 설립된 사립 박물관이다. 무형문화재 제108호(목조각장)인 박찬수 선생이 설립하였다. 1989년 2월 착공해 이듬해 전시관을 완공한 후 전통공예관으로 개관한 뒤, 학예연구실·소반정사·야외전시관 등 부속건물을 조성하였다. 1993년 야외전시장에 미륵삼존대불을 점안하면서 정식 개관하였다. 박물관은 야외 조각 공원과 지하 1층, 지상 3층의 전시관으로 구성되어 있다. 전시관에는 불상, 불화, 불교 목공예품 등의 유물과 더불어 목아 박찬수 관장의 불교 목조각과 목공예 작품들이 전시되어 있고, 야외 조각 공원에는 미륵삼존대불, 비로자나불, 백의관음, 삼층석탑 등이 조화롭게 자리 잡고 있다."
2758036,14,몽양여운형기념관,20211018195837,20250318112219,,,"<a href=""https://www.yp21.go.kr/museumhub/contents.do?key=954#n"" target=""_blank"" title=""새창 : 몽양여운형기념관 사이트로 이동"">https://www.yp21.go.kr/museumhub/</a>",0,http://tong.visitkorea.or.kr/cms/resource/64/3336664_image2_1.JPG,http://tong.visitkorea.or.kr/cms/resource/64/3336664_image3_1.JPG,Type3,31,19,A02,A0206,A02060200,경기도 양평군 양서면 몽양길 66,,12583,127.3735472165,37.5305211288,6,"몽양기념관은 우리 민족의 자주독립과 평화통일을 위해 일생을 바친 민족의 위대한 지도자 몽양 여운형 선생의 삶과 정신을 널리 알리고자 2011년 11월 27일 개관했다. 함양 여씨가 양평에 입향한 1715년 지어진 생가는 몽양 선생이 1886년 출생해서 부친 탈상을 끝낸 뒤 서울로 이사 간 1908년까지 사신 곳이다. 6·25 전쟁 중에 소실되었다가 2001년 양평 군민들의 노력으로 생가터가 정비되고 이듬해 기념비가 건립되었다.

2008년 건국훈장 대한민국장이 추서된 것을 계기로 서거 64주년인 2011년 생가가 복원되었다. 생가 복원과 함께 건립된 기념관은 서거 당시 입고 계시던 혈의, 장례식에 사용된 만장, 서울 계동 집에 있던 책상, 2008년 추서된 건국훈장 대한민국장 등의 유품과 자료를 전시하여 선생의 삶과 정신을 체험할 수 있도록 꾸며져 있다. 몽양교육자료관은 몽양기념관의 부속시설로 2023년 5월 25일 개관했으며 몽양선생의 사상과 활동을 현대에 전파하는 창구로서 몽양의 자료들을 쉽게 편하게 보고 검색할 수 있는 곳이다. 또한 몽양의 자료와 서적이 있는 도서자료실과 70석 규모의 강당, 30석 규모의 교육실 등이 있다."
3081640,14,몽환,20240115171737,20250318095655,031-411-1004,,"<a href=""https://www.instagram.com/monghwan_official/"" target=""_blank"" title=""새창 : 몽환 홈페이지로 이동"">https://www.instagram.com/monghwan_official/</a>",,http://tong.visitkorea.or.kr/cms/resource/96/3081596_image2_1.jpg,http://tong.visitkorea.or.kr/cms/resource/96/3081596_image3_1.jpg,Type3,31,15,A02,A0206,A02060300,경기도 안산시 단원구 원포공원1로 59 (초지동),B동 5층,15455,126.8112186481,37.3025457966,6,"몽환은 기존의 미디어아트 전시관과는 다른 새로운 시각과 경험을 제공하고 문화적 작품들을 현대예술의 기술로 감상할 수 있는 1,300평 규모의 초대형 전시관이다. 기존 전시관과는 다르게 앉아서 감상할 수 있고 다양한 시그니처 음료들과 칵테일, 브런치와 다이닝 음식을 전시관 안에서 먹을 수 있는 ‘미디어 아트’와 ‘다이닝 카페&펍’ 그리고 ‘스포츠’까지 접목된 콘셉트이다.  크게 4개의 구역에서 각각 다른 콘셉트의 미디어 아트를 감상할 수 있으며, 스포츠존에서는 다양한 이벤트 게임도 진행을 한다. 미디어 아트 영상은 낮과 밤의 영상이 달라 언제 방문하는지에 따라 다른 분위기를 느낄 수 있다."
130704,14,문아트그라운드 at 마가미술관,20060103090000,20250320112533,,,"<a href=""https://www.magmuseum.com/"" target=""_blank"" title=""새창: 문아트그라운드홈페이지로 이동"">https://www.magmuseum.com/</a>",0,,,,31,23,A02,A0206,A02060500,경기도 용인시 처인구 모현읍 문형동림로101번길 37,,16888,127.1928026182,37.3318047763,6,"문아트그라운드는 문갤러리, 아카이브, 실버스크린 각각의 테마가 있는 공간에서 커피와 함께 디저트를 즐길 수 있는 공간이다.
문갤러리는 아름다운 야외 풍경을 볼 수 있는 공간에 현대적인 판화와 타피스트리가 전시된 자연 속의 뮤지엄이며, 아카이브는 평화로운 숲속 도서관을 모티브로 디자인 된 곳에서 30년간 수집된 아트북, 한정판 책과 함께 영감을 주는 독서와 고요한 휴식을 취할 수 있다. 실버스크린은 국제적인 미디어 아트 팀들이 기획한 전시와 유명 뮤지션들이 참여하는 음악 이벤트가 열리는 공간으로 매 시즌 새롭게 변화하는 컨텐츠를 제공한다.
문아트그라운드는 예술과 기술, 자연과 아날로그가 조화를 이루며 방문객에게 독특하고 풍부한 문화적 경험을 제공한다. 단순한 관람을 넘어서 직접 체험하고 느끼며 참여할 수 있는 활동을 통해 예술을 새로운 방식으로 경험할 수 있다. 자연과 기술이 어우러진 공간의 미디어 아트부터 전통적인 아트북에 이르기까지 다양한 예술 작품을 추구한다. 매 시즌 다채로운 음악 공연과 특별 이벤트를 통해 예술과 엔터테인먼트가 결합된 새로운 ‘아트테인먼트’ 문화를 소개한다."
1753541,14,문화예술원 마루홀,20121117011455,20240613100127,,,"▪ <a href=""http://yicf.or.kr/"" target=""_blank"" title=""새창 : 용인문화재단 홈페이지로 이동"">http://yicf.or.kr</a>",0,http://tong.visitkorea.or.kr/cms/resource/09/3068809_image2_1.jpg,http://tong.visitkorea.or.kr/cms/resource/09/3068809_image3_1.jpg,Type3,31,23,A02,A0206,A02060600,경기도 용인시 처인구 중부대로 1199,(삼가동),17019,127.1774732269,37.2412455395,6,"용인문화복지행정타운 내에 있는 문화예술원 마루홀은 용인 시민의 여가와 문화생활 증진을 위해 2005년 개관하였다. 2011년 출범한 용인문화재단이 운영하고 있다. 
문화예술원은 총면적 1,978m²의 지상 4층, 지하 1층 건물로 용인문화재단 및 산하 여러 단체가 입주해 있으며, 공연장, 전시실, 회의실, 용인 디지털정보도서관 등이 있다. 특히 290명(장애인 4석 포함) 수용가능한 소극장 마루홀과 180명을 수용할 수 있는 국제회의실 등의 시설을 갖추고 있는데, 특히 마루홀은 무대 면적 129.22m²로 공연장 내 반사음은 줄이고 잔향은 최대한 살리는 방향으로 음향효과를 극대화해 최상의 소리가 전달될 수 있도록 조성되었다. 아동극, 가족극 위주의 다양한 공연이 진행되고 있으며, 용인시청 안에 있어 접근성이 좋아 [마루]라는 이름처럼 온 가족이 편안하게 드나들며 문화생활을 영유하는 공간으로 사랑받고 있다. 
서용인IC에서 약 4분, 에버라인 시청∙용인대역에서 도보 9분(462m) 소요된다. 인근에 에버랜드, 한국민속촌, 한국잡월드, 세계문화유산 융건릉, 물향기수목원, 용인농촌테마파크, 덕평공룡수목원 등이 있다."
2623847,14,뮤지엄그라운드,20191010225210,20250320100006,,,"<a href=""https://museumground.org/""target=""_blank"" title=""새창: 뮤지엄그라운드"">https://museumground.org/</a>",0,http://tong.visitkorea.or.kr/cms/resource/57/3366257_image2_1.jpg,http://tong.visitkorea.or.kr/cms/resource/57/3366257_image3_1.jpg,Type3,31,23,A02,A0206,A02060500,경기도 용인시 수지구 샘말로 122 (고기동),,16800,127.0441126426,37.3565020225,6,"2018년 10월, 경기도 용인시에 새로이 개관한 뮤지엄 그라운드(Ground Museum of Contemporary Art)는 UNIQUE 땅 (地) · 대지(大地) 미술관의 뜻을 품고 있습니다. 본 미술관은 국내 · 해외의 다양한 문화 예술의 시도와 새로운 실험이 이루어지며, 모든 대중들과 소통하는 복합문화공간이 되고자 한다. 현대적인 건축 공간 속, 총 3개의 전시 공간 (제 1,2,3 전시실)과 멀티교육실, 야외 조각 공원 (오픈 그라운드)과 선큰 공간 (언더그라운드), 카페 그라운드로 구성되어 예술과 체험 그리고 휴식이 공존하는 공간이다. 나아가 풍성한 문화와 예술, 창작 활동의 복합 플랫폼으로서 전 연령의 관객들에게 열려 있는 미술관을 지향한다. 뮤지엄그라운드는 지역사회와 함께 호흡하며 모든 시각 예술의 경계를 넘나들며 시의성 있는 주제와 시선으로 동시대 예술 문화를 대중들과 함께 공감해 갈 예정이다.

(출처 : 뮤지엄그라운드 홈페이지)"
3369652,14,뮤지엄헤이,20240919161215,20250324135917,,,"<a href=""https://www.museumhei.com/"" target=""_blank"" title=""새창: 뮤지엄헤이 홈페이지로 이동"">https://www.museumhei.com/</a>",,http://tong.visitkorea.or.kr/cms/resource/40/3369640_image2_1.png,http://tong.visitkorea.or.kr/cms/resource/40/3369640_image3_1.png,Type3,31,27,A02,A0206,A02060300,경기도 파주시 탄현면 평화로 885-43,,10862,126.6902995635,37.7829072380,6,"파주시 탄현면 통일동산 관광특구 내 1200평 규모로 개관한 미디어아트 전용 전시관이다. 행복지수 세계 1위인 핀란드의 인사말 ‘Hei’에서 모티브를 얻어 이름을 지었다. ‘인생의 아름다운 순간들’을 주제로 시공간, 자연, 일상 등 20여 가지의 콘텐츠를 선보인다. 공감각적인 예술의 경험뿐만 아니라 시각, 청각, 후각을 만족시키는 오감만족 전시로 가족, 연인, 친구 등 남녀노소 모두가 즐기는 전시를 지향한다. 전시관 내 디지털 작가 존을 만들어 신진 작가나 학생 등 미디어작가를 꿈꾸는 이들에게 전시장소를 제공하는 미디어 아티스트의 등용문 역할을 하고자 한다. 3층에는 미디어 아카데미를 운영하여 미디어 콘텐츠 제작 체험, 교육을 통해 미디어 산업 발전에도 기여하고자 한다."
2630998,14,미리내마술극단 은하수홀,20191028231828,20241030130644,,,"<a href=""http://www.mirinemagic.com/""target=""_blank"" title=""미리내마술극단 은하수홀"">http://www.mirinemagic.com/</a>",0,,,,31,13,A02,A0206,A02060600,경기도 수원시 팔달구 정조로 767-8,(팔달로3가),16261,127.0161118661,37.2767024343,6,"수원 화성행궁 인근에 위치한 100석 규모의 마술전용소극장으로써 주말마다 관광객, 지역주민을 대상으로 마술과 다양한 퍼포먼스가 혼합된 공연을 진행하고 있고 대표로 '어린이마술쇼', '사라진마술사'가 있다. 이 외에도 수원이라는 도시를 재미있는 스토리와 마술로 표현하여 알리는 '매직 카펫 라이드 in 수원' 이라는 공연이 있으며, 다양한 공연을 연간 진행하고 있다. 미리내 마술극단은 흡연예방, 학교폭력예방, 자살예방등 각종 청소년 프로그램을 전국에서 진행하고 있으며,수원에 있는 본사는 화성행궁, 치킨거리, 공방거리 등 관광할 수 있는 관광지가 많아 수원을 찾는 관광객들에게 이색적인 볼거리를 함께 제공하고 있다."
