contentid,contenttypeid,title,createdtime,modifiedtime,tel,telname,homepage,booktour,firstimage,firstimage2,cpyrhtDivCd,areacode,sigungucode,cat1,cat2,cat3,addr1,addr2,zipcode,mapx,mapy,mlevel,overview
3008372,14,아스카 게임박물관,20230906161341,20241108161107,,,"<a href=""https://retroboyz.modoo.at/"" target=""_blank"" title=""새창 : 홈페이지로 이동"">https://retroboyz.modoo.at</a>",,http://tong.visitkorea.or.kr/cms/resource/68/3003168_image2_1.jpg,http://tong.visitkorea.or.kr/cms/resource/68/3003168_image3_1.jpg,Type3,31,27,A02,A0206,A02060100,경기도 파주시 탄현면 헤이리마을길 59-101,,10859,126.6955960523,37.7916840860,6,"아스카 게임박물관은 헤이리 예술마을 안에 위치한 국내최초 개인수집 레트로 게임박물관이다. 
아스카 게임박물관은 게임박물관과 레트로보이즈(전파박물관)으로 구성되어 있는데, 1층~2층 일부 게임박물관에서는 80~90년대 레트로 게임기(패미컴/3D얼라이브/PC엔진/PS1/새턴등)와 소프트웨어(고전팩 및 희귀팩 고전  PC게임 등)를 전시 체험할 수 있고, 당시 오락실에 있던 추억의 펌프, 드럼매니아, 각종 보드게임 등을 직접 즐겨볼 수 있다. 2층 일부 ~ 3층 레트로보이즈(전파박물관)에서는 당시 유행했던 만화책과 80-90년대 레트로기기(음향/영화/핸드폰/TV/라디오/고전프라모델/잡지 등)와 1980년대~2000년대까지의 다양한 완구 및 캐릭터 전시, 비디오방, CD, LP 청음실 등 각종 대중문화 컨텐츠 소장품을 모두 만나볼 수 있다. 또 추억의 불량식품과 커피를 비롯한 음료 판매 코너도 준비되어 즐길 수 있다.
성동IC에서 차량으로 약 6분 거리에 위치하고 있으며, 헤이리 게이트 4,5번에서 약 200m 떨어져 있다. 김중업건축박물관, 안양예술공원이 같은 경내에 있으며, 근처에 맛집과 카페가 모여있는 안양예술공원 음식문화거리도 있다.
인근에 파주출판도시, 임진각(평화누리공원), 세계문화유산 파주삼릉, 하니랜드, 운정호수 등이 있다."
130943,14,아주대학교도구박물관,20070802090000,20250315121309,,,"<a href=""http://museum.ajou.ac.kr/"" target=""_blank"" title=""새창 : 홈페이지로 이동"">http://museum.ajou.ac.kr</a>",0,http://tong.visitkorea.or.kr/cms/resource/66/3475866_image2_1.JPG,http://tong.visitkorea.or.kr/cms/resource/66/3475866_image3_1.JPG,Type3,31,13,A02,A0206,A02060100,경기도 수원시 영통구 월드컵로 206,(원천동),16499,127.0453285020,37.2823050852,6,"1993년 개관한 아주대학교박물관은 인류 역사 발전에 기여한 도구를 연구, 전시, 교육하는 기관이다.
개교 40주년을 맞이하여 현재 종합관 건물 1층으로 전시실을 이전하여 [도구박물관]과 [아주역사전시실]을 개관하였다. 도구박물관에는 선사시대부터 근대에 이르는 기술과 관련된 옛 도구들을 중심으로 한 소장품들을, 아주역사전시실에는 대학의 설립 시기부터 현재에 이르기까지 대학의 변천 과정을 볼 수 있는 대학의 역사 자료들을 전시하고 있다. 평택 원정리 유적 발굴조사보고서와 관창리 유적 발굴조사보고서가 있으며 전시용 도록에는 툴툴씨네 가족 이야기, 아주 30년 역사 자료 특별전, 새가 되고 싶은 나무가 전시되어 있다.
2019년 박물관, 길 위의 인문학 및 지역 문화예술 플랫폼 육성사업을 신청하여 지역 사회를 대표하는 대학박물관으로서 지역 사회의 문화 역량 강화와 문화적 가치의 발굴에 앞장서고 사회 변화에 부응하기 위해 박물관 발전에 노력하고 있다."
2709707,14,아트센터 화이트블럭,20210312025608,20240502134502,,,"<a href=""https://www.whiteblock.org/"" title=""새창 : 홈페이지로 이동"">https://www.whiteblock.org/</a>",0,http://tong.visitkorea.or.kr/cms/resource/97/3080197_image2_1.jpg,http://tong.visitkorea.or.kr/cms/resource/97/3080197_image3_1.jpg,Type3,31,27,A02,A0206,A02060500,경기도 파주시 탄현면 헤이리마을길 72,,10859,126.6994263339,37.7889594722,6,"파주시 헤이리 예술마을 중심 갈대광장에 있는 아트센터 화이트블럭은 사설 미술관이다. 헤이리 예술마을은 건물 높이 3층 이하, 건축 재료는 목재, 콘크리트, 철 등으로 제한하여 건축하도록 규정하고 있어 건물 하나하나가 예술작품처럼 건축되어 있는 마을이다. 
미술관은 2012년 미국 건축가상 수상작으로 선정된 건축물로 건물 자체만으로도 멋스러운 공간이다. 1층은 카페와 수공예품, 액세서리 등을 판매하는 매장이 있고, 2층, 3층은 미술관이다. 아트센터 화이트블럭은 작가들의 작품 발표의 장이자, 미술계 이론가와 작가들의 교류와 협력의 플랫폼이며, 헤이리를 찾는 다양한 연령대의 관객에게는 미술 문화 향유의 공간이다. 카페는 실내와 외부가 자연스럽게 소통되는 구조로 미술작품 감상뿐 아니라 휴식을 즐기는 공간으로 활용되고 있다."
2615462,14,아해박물관,20190816225235,20250328105315,,,"<a href=""http://www.ahaemuseum.org/""target=""_blank""title=""새창:아해박물관"">http://www.ahaemuseum.org/</a>",0,,,,31,3,A02,A0206,A02060100,경기도 과천시 추사로 133,(주암동),13820,127.0300027435,37.4576344844,6,"아해한국전통문화어린이박물관은 유아, 초등학생을 대상으로 한 전통놀이감을 전시한 박물관이다. 아해한국전통문화어린이박물관 명칭 중 아해는 어린이의 순 우리말이다. 이 박물관에서는 한국의 5천년 역사를 간직한 놀이감들을 수집 보존하고 전시하여 전통놀이감 또한 소중한 역사임을 일깨워주고 있다. 상설전시관에서는 방안놀이, 하늘놀이, 들판놀이, 서당놀이 등으로 분류되어 전시되어 있다. 기획전시실과 교육공간에서는 예절, 전통음식, 우리미술 등을 체험 해볼 수 있는 자리를 마련하였다. 야외에는 마당놀이감과 숲놀이감이 전시되어 있어 다양한 놀이를 체험해볼 수 있으며, 아해 숲길이 조성 되어 있다."
654645,14,안산 어촌민속박물관,20081119182020,20250319094035,,,"<a href=""https://www.ansanuc.net/museum/index.do"" target=""_blank"" title=""새창 : 홈페이지로 이동"">https://www.ansanuc.net/museum</a>",0,http://tong.visitkorea.or.kr/cms/resource/47/3342647_image2_1.jpg,http://tong.visitkorea.or.kr/cms/resource/47/3342647_image3_1.jpg,Type3,31,15,A02,A0206,A02060100,경기도 안산시 단원구 대부황금로 7,(선감동),15652,126.6461116918,37.1924945304,6,"안산 어촌민속박물관은 경기도 대부도 탄도항에 있는 박물관으로 간척사업으로 인해 사라져 가는 경기만 갯벌의 문화와 생활상을 연구하고 보존하기 위하여 설립되었다. 박물관 상설전시실은 총 3개 관으로 경기만 갯벌의 생태, 민속, 문화에 대한 다양한 전시가 준비되어 있다. 제1전시실에서는 살아 숨 쉬는 섬 대부도와 갯벌 생태계의 특징을 각종 자연 모형과 아크릴 박제를 통해 살펴볼 수 있으며 갯벌 생태계를 구성하는 다양한 생물들을 만나볼 수 있다. 제2전시실에서는 대부도의 각각의 갯바탕 특징에 따른 다양한 어민들의 어업문화를 살펴볼 수 있으며, 제3전시실에서는 역사적 흐름에 따라 발굴 유적과 주민들의 반농반어 생활상과 포도 농사와 염전으로 대표되는 대부도의 모습을 살펴볼 수 있다. 또한 대부도의 ‘ㅁ’자 형태의 전통가옥의 모습과 그 안의 다양한 민속유물을 통하여 대부도 섬마을 사람들의 일상을 살펴볼 수 있다. 이밖에 수유실, 도서실, 3D 영상실의 기타 편의시설이 운영되고 있으며, 탄도항 일대 가족 단위 관람객을 위한 주말 생태 체험행사 및 점차 사라져 가는 우리의 전통 세시풍속을 알아보는 민속 문화 체험 프로그램을 운영하고 있다."
3310700,14,안산다문화작은도서관,20240614155229,20250318100514,,,"<a href=""https://blog.naver.com/dadada2661"" target=""_blank"" title=""새창 : 안산다문화작은도서관 블로그로 이동"">https://blog.naver.com/dadada2661</a>",,http://tong.visitkorea.or.kr/cms/resource/76/3310676_image2_1.jpg,http://tong.visitkorea.or.kr/cms/resource/76/3310676_image3_1.jpg,Type3,31,15,A02,A0206,A02060900,경기도 안산시 단원구 부부로 43 (원곡동),지하 1층,15377,126.7903530484,37.3324864006,6,"안산다문화작은도서관은 MBC와 국립중앙도서관이 공동으로 전개한 작은 도서관 후원 캠페인의 결실로 한국수출입은행의 지원을 받아 2008년 10월 개관했다. 2014년부터는 한양대학교 ERICA 글로벌다문화연구원에서 위탁운영하고 있다. 도서관의 회원은 3,000여 명이고, 현재 24개 국가의 다국적 도서를 13,000여 권 정도 소유하고 있다. 이곳에서는 대상별 맞춤형 프로그램을 운영하고 있으며, 2024년 5월을 기준으로 81종의 프로그램을 909회 진행하였고, 11,358명이 참여했다. 프로그램을 통해 생애 전반 책 읽기 습관 형성에 도움을 주려 노력하고 있다. 또한 다국적 이용자가 모여있는 동아리를 운영하고 있으며, 세계명예사서와 이주민 자조모임이 활성화되어 있다. 이처럼 안산다문화작은도서관은 다문화와 비다문화 가정의 소통의 장으로 단원구의 사랑방 역할을 하고 있다."
130556,14,안산문화예술의전당,20050401090000,20240611094823,,,"<a href=""https://www.ansanart.com/main/ansanart/index.do"" target=""_blank"" title=""새창 : 홈페이지로 이동"">https://www.ansanart.com</a>",0,,,,31,15,A02,A0206,A02060600,경기도 안산시 단원구 화랑로 312,,15355,126.8229588005,37.3186413608,6,"안산문화예술의전당은 안산을 대표하는 문화공간으로, 지하철 4호선 고잔역 1번 출구 바로 맞은편에 있다. 안산문화예술의전당은 해돋이극장, 달맞이극장, 별무리극장 등 3개의 공연장과 1개의 국제회의장이 있으며, 4개의 전시실을 갖춘 복합문화 예술공간이다.
해돋이극장은 대규모 다목적 공연장으로 승강무대와 회전무대, 오케스트라 피트 등이 갖추어져 있어 각종 콘서트와 오페라, 발레, 뮤지컬 등 다양한 실내 공연이 개최되는 곳이다. 달맞이 극장은 중극장으로 승강무대와 영사 시설을 갖추고 있어 연극이나 무용 발표회, 실내악 공연과 독주회, 영화 상영 등의 목적으로 이용되고 있다. 별무리극장은 가변식 무대와 좌석을 갖춘 소극장이며 소규모 연극이나 국악 공연, 전위 연극 등의 공연을 개최하고 있다.
공연동 앞뜰에 마련된 야외공연장은 약 1,000석의 계단식 좌석을 갖추고 있으며 각종 마당놀이와 대중음악 등의 공연과 영화 상영 등 다양한 야외 공연이 이곳에서 열리며, 기획전시실에서는 회화나 서예, 조각품, 사진전, 조형예술 등의 전시회가 개최된다.
안산문화예술의전당 내에는 베이커리 카페도 두 곳이나 있어 공연 전이나 후에 편하게 이용할 수 있다."
129864,14,안산문화원,20071106103335,20240607133826,,,"▪ <a href=""https://www.ansanculture.or.kr/"" target=""_blank"" title=""새창 : 홈페이지로 이동"">https://www.ansanculture.or.kr</a>",0,http://tong.visitkorea.or.kr/cms/resource/89/3042389_image2_1.JPG,http://tong.visitkorea.or.kr/cms/resource/89/3042389_image3_1.JPG,Type3,31,15,A02,A0206,A02060700,경기도 안산시 상록구 석호로 144,(사동),15585,126.8477015303,37.2993690339,6,"안산문화원은 안산시 상록구 사동에 있는 지역문화 예술진흥기관이다. 안산문화원은 전국 시범 문화원이 되고, 지방문화원진흥법에 의해 특별 법인으로 안산문화원 설립 허가를 받으면서 단순한 역사 문화에 대한 발굴뿐만 아니라 실제적인 계승과 교육에 앞장서게 되었다.
1991년부터 시작된 관내 향토 유물 수집 사업으로 2천 여 점에 이르는 유물을 수집하였고, 이를 토대로 원사 내 1층 향토사박물관을 설립하여 많은 시민이 안산의 역사를 한눈에 볼 수 있도록 하였다.
야외 전시장에는 안산지역의 전통 초가, 연자방앗간, 물레방앗간 등을 재현·전시하여 휴식의 공간이자 동시에 아이들에게는 전통문화 체험 공간으로 어른들에게는 문화적 향수를 충족시킬 수 있는 문화공간을 제공하고 있다.
특히 안산문화원에서 운영하는 안산문화학교는 문화예술진흥법에 따라 안산에서는 유일하게 지역 문화학교로 지정된 곳으로 경기민요, 풍물놀이, 사물놀이, 서예, 서양화, 한국화, 문인화, 대금, 단소, 경기민요, 한국무용, 남도민요, 아코디언, 명리학, 서각, 민화, 한문 서당, 꽃 예술 등의 강좌를 운영하고 있다."
3448385,14,안산미디어도서관,20241218114333,20241223095813,,,http://lib.iansan.net/main.do?sitekey=31,,http://tong.visitkorea.or.kr/cms/resource/98/3450098_image2_1.jpg,http://tong.visitkorea.or.kr/cms/resource/98/3450098_image3_1.jpg,Type1,31,15,A02,A0206,A02060900,경기도 안산시 단원구 광덕1로 198 (고잔동),안산미디어라이브러리,15483,126.8311833688,37.3072650480,6,"안산미디어도서관은 경기도 안산시에 위치한 현대적인 도서관으로, 미디어와 정보 기술을 활용한 다양한 문화와 교육 프로그램을 제공하는 복합 문화 공간이다. 이 도서관은 일반적인 도서관의 기능 외에도, 최신 미디어 장비와 자료를 갖추고 있어 다양한 디지털 콘텐츠와 멀티미디어 자료를 접할 수 있는 장점이 있다. 또한, 영화 상영, 강연, 워크숍 등 다양한 문화 행사와 교육 프로그램을 통해 지역 주민들에게 풍성한 문화적 경험을 선사한다. 안산미디어도서관은 특히 젊은 세대와 미디어에 관심이 있는 사람들에게 유익한 공간으로, 도서관 방문객들이 책뿐만 아니라 다양한 디지털 자료와 미디어 콘텐츠를 통해 학습하고 즐길 수 있는 공간이다."
3351850,14,안산별망어촌문화관,20240822093017,20241107102320,,,https://www.ansanuc.net/homenew/12214/40324/contents.do,,http://tong.visitkorea.or.kr/cms/resource/18/3408818_image2_1.jpg,http://tong.visitkorea.or.kr/cms/resource/18/3408818_image3_1.jpg,Type1,31,15,A02,A0206,A02060300,경기도 안산시 단원구 시화호수로 553 (성곡동),,15655,126.7297121086,37.3048357574,6,별망어촌문화관은 반월공단과 시화호 개발이 추진되면서 사라져버린 마을을 재조명하기 위해 만들어진 공간이다. 도시화 과정 속에서 지금은 잊혀져버린 어촌마을의 삶과 이야기를 만나볼 수 있다. 1층은 안산시 특산품 판매시설이 운영되고 있으며 2층은 별망마을의 재현과 시화호 일대의 어업문화를 소개하는 전시와 인터랙티브 터치영상 및 모래체험 등의 체험형 전시가 구성되어 있다.
3081404,14,안산산업역사박물관,20231113095508,20240115152234,,,"<a href=""https://ansan.go.kr/aim/"" target=""_blank"" title=""새창 : 홈페이지로 이동"">https://ansan.go.kr</a>",,http://tong.visitkorea.or.kr/cms/resource/96/3081396_image2_1.JPG,http://tong.visitkorea.or.kr/cms/resource/96/3081396_image3_1.JPG,Type3,31,15,A02,A0206,A02060100,경기도 안산시 단원구 초지동,,15385,126.8172341994,37.3230157521,6,"안산산업역사박물관은 대한민국 산업화에 지대한 영향을 끼쳤던 안산의 산업사와 변천사를 한눈에 살펴볼 수 있는 복합문화공간이다. 1만여 점의 산업 유물이 전시되어 있고 도시발전을 함께한 시민들의 이야기가 기록된 과거와 현재, 미래를 잇는 역사적 현장이 되고 새로운 산업 동력을 모색하는 공간으로 안산 산업 역사를 한 눈에 볼 수 있다.
안산산업역사박물관은 미니어처나 모형, 사진만 전시하는 것이 아닌 과거 실제로 사용했거나 존재했던 버스, 기계, 자동차를 실제로 전시한다는 점에서 더 흥미롭고 실감이 난다. 야외 전시장에 있는 과거 안산지역을 순회 운행하던 버스와, 과거 시흥시 소래 염전과 남동 염전에서 소금을 운반하던 궤도차가 바로 그것이다. 또한 1층 로비에도 과거 우리가 사용했던 압력솥, 컴퓨터, 난로 등 일상생활에서 자주 접하던 제품들을 볼 수 있으며 2층 상설전시장에서도 각종 기계와 부품, 자동차, TV, 전화기, 목제 솜틀 등 아날로그 감성을 자극하는 추억 속 제품들이 전시되어 있으며 박물관 3층 옥상에서 영화 상영이나 가수와 청년 뮤지션들의 공연도 이루어지고 있어 지역주민들의 문화공간으로도 활용되고 있다."
3035802,14,안산세계문화체험관,20231110095141,20241118090421,,,"<a href=""https://www.ansan.go.kr/global/common/cntnts/selectContents.do?cntnts_id=C0001005"" target=""_blank"" title=""새창 : 홈페이지로 이동"">https://www.ansan.go.kr/global</a>",,http://tong.visitkorea.or.kr/cms/resource/79/3002579_image2_1.jpg,http://tong.visitkorea.or.kr/cms/resource/79/3002579_image3_1.jpg,Type3,31,15,A02,A0206,A02060800,경기도 안산시 단원구 원곡동,,15378,126.7917362935,37.3311282484,6,"안산세계문화체험관은 우리나라의 대표적인 다문화 마을인 안산 다문화마을특구에 있으며, 내국인과 더불어 살아가는 사회를 만들기 위해 다문화 이해교육장으로 개관하여 50여 국가에서 수집한 악기와 인형, 음식, 의상, 가면, 건축물 등 1,400여 점을 전시하고 전시물을 가지고 각 나라의 전통문화를 체험할 수 있다.
전시실 내부에는 외국에 나가면 기념품으로 하나씩 챙겨오고 싶은 각종 전통 조각품과 크기와 형태가 다양한 여러 나라의 화폐들이 전시되어 있고, 벽면에 걸린 세계지도 앞쪽에는 각 나라를 대표하는 건축물이나 고유의 전통 의상을 입은 인형과 악기 등이 전시되어 있다. 
우리나라 하회탈을 비롯하여 세계 각국의 가면과 주석 주전자, 병마용, 갑옷같이 오래된 물건들이 있고, 인도네시아와 아프리카의 전통 악기들도 만나볼 수 있다. 전시관에서 몇 계단 내려간 곳에 영국 근위병 근무복, 우즈베키스탄 전통 혼례 의상을 비롯하여 중국, 일본, 베트남, 러시아, 캄보디아, 인도네시아, 우즈베키스탄 등 250여 벌의 의상과 장신구가 준비되어 있어 직접 입어보고 체험할 수 있다."
2761633,14,안산올림픽기념관,20211025201844,20250318113717,,,"<a href=""https://www.ansanuc.net/homenew/index.do""target=""_blank"" title=""새창: 안산올림픽기념관 홈페이지로 이동"">https://www.ansanuc.net/</a>",0,http://tong.visitkorea.or.kr/cms/resource/93/3340293_image2_1.jpg,http://tong.visitkorea.or.kr/cms/resource/93/3340293_image3_1.jpg,Type3,31,15,A02,A0206,A02060200,경기도 안산시 단원구 적금로 202,(고잔동),15335,126.8273470837,37.3260683551,6,"안산 올림픽기념관은 경기도 안산시 단원구에 위치한 문화시설이다. 공연장, 수영장, 소극장, 체육관이 있으며 공연장의 경우 420석 규모로 다양한 교육이나 행사, 연극제, 발표회가 가능하고 시민들을 위한 영화 상영을 하기도 한다. 또 수용인원 100석의 소극장에서는 노래교실을 운영하고 있으며, 88 서울 올림픽 기념사진을 전시하고 있다. 올림픽 수영장에서는 누구나 수영을 즐길 수 있다. 나무 그늘이 많고 산책로가 잘 되어 있어 주민들이 자주 찾는 곳이다."
3351854,14,안산향토사박물관,20240822093252,20241219113137,,,https://www.ansanculture.or.kr/sub/museum/introduce.php?code=30,,http://tong.visitkorea.or.kr/cms/resource/31/3408831_image2_1.jpg,http://tong.visitkorea.or.kr/cms/resource/31/3408831_image3_1.jpg,Type1,31,15,A02,A0206,A02060100,경기도 안산시 상록구 석호로 144 (사동),,15585,126.8488819948,37.2987968985,6,"안산은 바다와 인접해있고 넓은 토지가 있어 농업과 어업이 성행했다. 특히 영·정조 시대 문예부흥기의 중심지로 많은 역사적 인물을 배출했는데 이러한 역사적 사실을 안산시민 뿐만 아니라 관외 지역민에게도 알리기 위하여 향토사박물관을 설립했다. 박물관 내에는 안산지역 문화유적지에서 발견된 유물자료와 고문서, 근현대 민속품에 이르기까지 2천여점의 유물을 수집하여 소장하고 있다."
130439,14,안성 3.1운동기념관,20051228090000,20241017170454,,,"<a href=""https://www.anseong.go.kr/tourPortal/41/main.do"" target=""_blank"" title=""새창 : 안성 3.1운동기념관 홈페이지로 이동"">https://www.anseong.go.kr</a>",0,http://tong.visitkorea.or.kr/cms/resource/29/1589729_image2_1.jpg,http://tong.visitkorea.or.kr/cms/resource/29/1589729_image3_1.jpg,Type3,31,16,A02,A0206,A02060200,경기도 안성시 원곡면 만세로 868,,17555,127.1752784178,37.0627716844,6,"안성 만세로에 있는 안성3·1운동 기념관은 안성지역의 만세운동과 관련한 유물과 기록들이 전시되어 있는 곳이다. 1919년 3·1운동 당시 전국 3대 실력 항쟁지로 가장 격렬한 만세운동을 펼쳐 일제 식민통치기관을 완전히 몰아내고, 2일간의 해방을 이룩한 안성 4·1만세운동의 역사를 널리 알리며, 선열들의 숭고한 자주독립 정신을 계승 발전시켜 후세들에게 나라사랑의 산 교육장으로 활용하기 위해 세워진 곳이다. 
기념관은 상설전시실과 기획전시실, 기획전시실, 야외 체험으로 구성되어 있다. 전시관에서는 독립운동의 역사적인 자료를 실물 전시, 모형, 영상물과 함께 관람할 수 있다. 이 밖에도 기념관 내에는 안성지역 독립운동가 선열들의 넋을 위로하고 그 뜻을 기리기 위한 사당인 광복사, 안성3·1운동의 가치와 역사적 항쟁사를 표현한 기념탑인 안성3·1운동 기념탑 등이 있다. 
교육 프로그램으로는 안성 독립운동 이야기를 들려주는 창작 인형극과 직접 무궁화를 관찰하고 재밌는 체험을 해볼 수 있는 나라사랑꽃 무궁화 등이 준비되어 있다."
130547,14,안성 남사당 공연장,20050309090000,20240529175454,,,"<a href=""https://www.anseong.go.kr/tourPortal/namsadang/main.do"" target=""_blank"" title=""새창 : 홈페이지로 이동"">https://www.anseong.go.kr</a>",0,http://tong.visitkorea.or.kr/cms/resource/81/1781881_image2_1.jpg,http://tong.visitkorea.or.kr/cms/resource/81/1781881_image3_1.jpg,Type3,31,16,A02,A0206,A02060600,경기도 안성시 보개면 남사당로 198-2,,17508,127.3101448759,37.0318221187,6,"안성 남사당 공연장은 원형 공연장으로 남사당놀이를 비롯한 전통놀이 공연을 특성화하기 위하여 건립된 곳이다. 남사당 공연장은 700석 이상의 객석과 20m의 원형무대, 13m의 승강식 무대를 갖춘 곳으로 남사당놀이를 위한 최고의 공연장이다."
130440,14,안성맞춤박물관,20041223090000,20240620133839,,,"<a href=""https://www.anseong.go.kr/tourPortal/museum/main.do"" target=""_blank"" title=""새창 : 홈페이지로 이동"">https://www.anseong.go.kr</a>",0,http://tong.visitkorea.or.kr/cms/resource/17/2996017_image2_1.jpg,http://tong.visitkorea.or.kr/cms/resource/17/2996017_image3_1.jpg,Type3,31,16,A02,A0206,A02060100,경기도 안성시 대덕면 서동대로 4726-15,,17546,127.2283306103,37.0114035624,6,"중앙대학교 다빈치캠퍼스 입구에 세워진 안성맞춤 박물관은 유기를 중심으로 안성의 풍부한 문화유산을 함께 접할 수 있는 테마 박물관이다. 흔히 사람들은 매우 잘 맞음을 비유하여 [안성맞춤]이라는 말을 쓰는데, 이 말은 안성에서 유기를 만드는 장인들이 뛰어난 솜씨로 유기를 정성껏 만들어 품질이나 모양 등 기교면에서 많은 사람들의 마음을 만족시켜 생겨난 표현이다. 
박물관은 지상 2층, 지하 1층, 총 3층으로 이루어져 있으며, 유기 전시실, 영상실, 기획 전시실, 농업역사실, 향토 사료실, 세미나실, 학예연구실, 수장고 등으로 이루어져 있다. 유기 전시실은 유기의 역사, 제작 방법별 유기 분류, 유기 제작 과정 모형, 제기, 반상기, 무구, 불기 등 생활 속에 쓰이는 다양한 유기를 전시하고 있다. 또한 관람객의 이해를 돕기 위해 곳곳에 영상물을 설치하였는데 터치스크린을 통해 안성의 역사와 문화에 대한 자세한 설명을 볼 수 있다. 농업역사실은 안성 농업의 역사와 계절에 따른 농경 모습, 안성의 특산물이 전시되어 있어 과거와 현재의 안성농업을 알 수 있다. 향토 사료실에는 안성의 옛 모습이 담긴 사진, 안성 장시 재현, 안성 남사당, 불교문화재 등 안성문화와 역사를 한눈에 볼 수 있다.
교육 프로그램으로는 유아를 대상으로 박물관 관람 문화를 익히고, 안성의 특산품에 대해 배울 수 있는 '안녕? 안성!' 등이 준비되어있다."
